Barcode,ItemName
3052503635705,BOURJOIS كرم پودر 123 پرفكت هارموني 57
3052503230429,BOURJOIS رژ لب ادیشن 4
3380814221516,CLARINS EYESHADOW OMBRE MINERAL-05
8011607211975,PUPA PROFESIONAL BB CREAM ANTI MACCHIA CREAM DARK SPOT SKIN 001
8011607145881,PUPA LIP PERFECTION NATURAL SHINE-010
8011607190461,PUPA PUPART EYESHADOW PALETTE 001
8011607146758,PUPA LASTING COLOR 5 ml-101
3605533144893,LANCOME LE CORRECTOR PRO PROFESSIONAL CONCEALER PALETTE CORRECT PERFECT_SET 300
8011607192199,PUPA LIKE A DOLL COMPACT BLUSH#204
8011607189083,PUPA ACTIVE LIGHT - LIGHT ACTIVING PERFECT SKIN FOUNDATION 11
3052503820101,BOURJOIS ریمل والیوم-1
3052503635507,BOURJOIS كرم پودر 123 پرفكت هارموني 55
4033651346643,BEYU مداد چشم-664
3052503815503,BOURJOIS مداد چشم متالیک ضد اب-55
3052503510712,BOURJOIS رژ لب COLOR BOOST7
59338118642,DELON نرم کننده گیاهی نارنگی و گلابی
3346470302327,GUERLAIN HABIT ROUGE DRESS CODE M EDP 100ML
3380814227211,CLARINS OMBRE MATTE CREAM TO POWDER MATTE EYESHADOW_272_02
3700831010502,AUBADE PARIS LE PARFUME W EDP 50ML
3380810113204,CLARINS BLUE ORCHID FACE TREATMENT OIL
3052503735214,BOURJOIS كرم پودر هلتي ميكس جديد 52
3605530317610,LANCOME GLOSS JUICY TUBES ULTRA SHINY HYDRATING LIP GLOSS -095
3052503642116,BOURJOIS كرم پودر BB 21
4051761006684,ANNY لاک ناخن جدید 361.80
3380811857954,CLARINS SET LES ESSENTIALS MEN-SUPER MOISTUR BALM 50ML ACTIVE FACE WASH+SHAMPOO & SHOWER GEL
3052503615219,BOURJOIS پودر فشرده بایودیتوکس 52
3365440353343,YSL M.U ROUGE VOLUPTE-009
3052503300900,BOURJOIS لاک ناخن جدید 09
3052503413303,BOURJOIS رژ لب مایع حجیم نما جدید 33
3052503903903,BOURJOIS رژ گونه جدید 39
3052503921631,BOURJOIS سایه تکی با افکت صدفی جدید 16
8011607180226,PUPA CHINA DOLL LASTING COLOR -GLOSSY NAIL POLISH 410
8011607194599,PUPA LASTING COLOR GEL 15
4033651006448,BEYU مداد ابرو 03
8426017040631,LOEWE AURA EDP W 120 ML
3147758336177,LANCOME PURE FOCUS PEAUX GRASSES OILY SKIN 50 ML
3386460005296,VAN CLEEF & ARPELS TSAR M EDT 100ML
8011607103447,PUPA MAGIC CONCEALER -602
3423474877553,ISSEY MIYAKE L'EAU D'ISSEY POUR HOMME SPORT POLAR EXPEDITION 2015 LIMITED EDITION M EDT 100ML
8011607145843,PUPA LIP PERFECTION NATURAL SHINE-006
3700831011004,AUBADE PARIS LE PARFUME W EDP 100ML
3052503759234,BOURJOIS رژ گونه جدید-92
3386460036528,BOUCHERON JAIPUR POUR HOMME EDP 100ML
3052503715209,BOURJOIS پنکیک برنزه کننده شکلاتی-2
3274870020872,KENZO MADLY OUD W EDP 80 ML
3346138900087,HERMES UNJARDIN SURLENIL EDT 100 ML
3380814227518,CLARINS OMBRE MATTE CREAM TO POWDER MATTE EYESHADOW_275_05
8011607190386,PUPA GLOSSY LIPS_ULTRA SHINE LIP GLOOS#400
3365440016118,YSL M.U ROUGE PUR COUTURE-28
8011607213061,PUPA VIVA CARIOCA LIKE A DOLL LUMINYS BLUSH 205
3052503667829,BOURJOIS مداد چشم جدید-78
3700578504005,MARLY LIPPIZAN EDT 125 ML
3352818717012,KENZO AMOUR FUCHSIA EDP W 50 ML
701666315926,AMOUAGE MAN INTERLUDE EDP 100ML
3052503605326,BOURJOIS پودر صورت هلتي بالانس 53
3423478837058,NARCISO RODRIGUEZ NARCISO 2015 EDT 50ML
59338112862,DELON شامپو گیاهی تمشک و کشمش
59338118635,DELON نرم کننده گیاهی تمشک و کشمش
3605532562483,LANCOMECOMPACT POWDER TEINT MIRACLE SPF 15-04
4033651323088,BEYU رژ هیدرو استار 308
4033651381996,BEYU پنکیک برنزه-9
8011607178285,PUPA MISS PUPA ULTRA BRILLIANT LIPSTICK 200
8011607214471,PUPA TRUE LIPS LIP LINER SMUDGED PENCIL #31
4033651346797,BEYU مداد چشم-679
3052503412009,BOURJOIS رژ لب مایع حجیم نما جدید 20
8011607194582,PUPA LASTING COLOR GEL 14
8011607208609,NATURAL MATT EFECT COMPACT POWDER FOUNDATION 030
3052503301211,BOURJOIS مداد لب ادیشن12
3349668508471,PACO RABANNE LADY MILLION EDP 30ML
3052503510514,BOURJOIS رژ لب COLOUR BOOST 5
3605532638973,LANCOME LIPSTICK ROUGE IN LOVE 6H 377 N
3365440217645,YSL ROUGE PUR COUTURE THE MAT-391-202
3423473988359,ELIE SAAB LE PARFUM RESORT COLLECTION W EDT 50ML
4033651345851,BEYU مداد خط لب-585
8011607211258,PUPA VIVA CARIOCA LASTING COLOR GEL DUO 001
3605533127834,LANCOME LIPSTICK ROUGE IN LOVE 6H 375 N
8437011481177,CARNER EL BORN EDP 100ML
8011607132386,PUPA ULTRA SMOOTHING FOUNDATION-404
3052503300610,BOURJOIS مداد لب ادیشن6
3052503940519,BOURJOIS سایه سه تایی اسموکی-5
8011607210015,PUPA I`M PURE COLOUR LIPSTICK ABSOLUTE SHINE #203
3274871923912,KENZO HOMME SPORT M ED 50 ML
3052503233024,BOURJOIS رژلب ادیشن 12 ساعت 30
59338121987,DELON شامپو نرم کننده نوتراتن 2در1
3423470890020,NARCISO RODRIGUEZ - FOR HER EDT 100 ML W
8011607146963,PUPA LASTING COLOR 5 ml-602
8011607228782,PUPA MADE TO LAST WP EYESHADOW LONG LASTING STICK EYESHADOW # 007
8011607228768,PUPA MADE TO LAST WP EYESHADOW LONG LASTING STICK EYESHADOW # 005
3346130490685,HERMES EAU DE ORANGE VERT EDC 100 ML
8011607203765,PUPA VAMP WET & DRY EYESHADOW -BAKED EYESHADOW 400
3052503155401,BOURJOIS کرم پودر AIRMAT54
4051761109767,ANNY لاک ناخن REGENERATING NAIL OIL
3346470301641,GUERLAIN HOMME-L'EAU BOISEE EDT 80ML
8411061723777,HERRERA   212 VIP Men EDT 50ml
8011607102938,PUPA LUMINYS BAKED EYESHADOW - Compact Eye Shadow Mono-402
4051761100764,ANNY لاک ناخن 76
3380810506105,CLARINS ANTI PEREPIRANT STICK MEN 75 ml
3365440714076,YSL GLOSS VOLUPTE-49725-102
3052503300917,BOURJOIS مداد لب ادیشن9
3052503301013,BOURJOIS مداد لب ادیشن10
3052503592039,BOURJOIS مداد لب جدید 20
3052503300412,BOURJOIS مداد لب ادیشن4
3052503591933,BOURJOIS مداد لب جدید 19
3052503591537,BOURJOIS مداد لب جدید 15
3052503510811,BOURJOIS رژ لب COLOR BOOST8
4033651337153,BEYU رژ لب مایع CRYSTAL 15
3052503300818,BOURJOIS مداد لب ادیشن8
3052503702124,BOURJOIS ریمل TWIST UP 21
4033651346506,BEYU مداد چشم-650
4033651336972,BEYU رژ لب مايع كت واك 97
3052503705132,BOURJOIS ریمل واترپروف 051
3052503810737,BOURJOIS مداد ابرو7
59338120690,DELON بادی باتر بادام شیرین و انجیر
3352810307648,KENZO HOMME BOISEE 100ML
3052503230320,BOURJOIS رژ لب ادیشن 3
8011607124381,PUPA GLITTER EYELINER-409
3052503715100,BOURJOIS پنکیک برنزه کننده شکلاتی-51
4051761103352,ANNY لاک ناخن 335
8011607175710,PUPA IROPICS HOT TOPICS WATER FALL GLOSS ULTRA SHINE MOISTURIZING LIP GLOSS #01
3052503414805,BOURJOIS رژ لب مایع حجیم نما جدید 48
4051761101839,ANNY لاک ناخن جد‌ید‌ ۱۸۳
3052503260518,BOURJOIS رژ لب ادیشن ولوت 5
3052503260112,BOURJOIS رژ لب ادیشن ولوت 1
3349668509669,PACO RABANNE 1MILLION  EDT 200ML
3423478922754,NARCISO RODRIGUEZ FOR HER GLITTERS & RIBBONS WITH AUTOMIZER LTD EDT 75 ML
3423473987550,ELIE SAAB LE PARFUM 2014 XMAS COLLECTOR LTD EDP 90ML
3423474867158,ISSEY MIYAKE-L'EAU D'ISSEY POUR HOMME SPORT EDT 100ML
3274870030888,KENZO L'EAU PAR KENZO POUR HOMME MIRROR  EDT 50 ML
3605532214344,LANCOME FOUNDATION TEINT MIRACLE SPF 15-010
3346470113664,GUERLAIN-IDYL 09 SPR EDT W 100ML
8011607044214,PUPA NEW CHIC - Luminous Lipstick-120
3380811452104,CLARINS AFTER SUN GEL ULTRA-SOOTHING 150 ML
8426017043885,LOEWE AURA W EDT 120 ML
3380814411511,CLARINS JOLI ROUGE-734-115
3274871932334,KENZO FLOWER BY KENZO TAG  EDP W 100ml
3423474831159,ISSEY MIAKE L EAU D ISSEY ABSOLUE LIMLTED EDITION W EDP 50ML
3052503737409,BOURJOIS کرم پودر بمبی ویتامینه-74
3052503155500,BOURJOIS کرم پودر AIRMAT55
3052503735313,BOURJOIS كرم پودر هلتي ميكس جديد 53
3052503637105,BOURJOIS كانسيلر استيكي پرفكت هارموني 71
3052503950112,BOURJOIS ریمل ابرو 01
3380810501100,CLARINS FOAMING GEL MEN 150 ml
8437011481023,CARNER D600 U EDP 50ML
3052503910314,BOURJOIS سایه چشم اینتنس 03
3380810500103,CLARINS FOAMING GEL MEN 125ML
8028713240225,ACQUA DI PARMA AMBRA EDC CONCENTREE 180 ML
4051761003751,ANNY سوهان ناخن 2در1
8011607173563,PUPA JEANSES ROSES LASTING COLOR 311
8426017039369,LOEWE AGUA CALA D OR U EDT 150 ML
701666250081,AMOUAGE LIBRARY OPUS VIII EDP 100ML
3052503827605,BOURJOIS مداد چشم برس دار 76
3052503707136,BOURJOIS ریمل پوش آپ واتر پروف
3052503476322,BOURJOIS رژ لب مایع افت تری دی مکس-63
4051761100450,ANNY لاک ناخن  45
3052503301204,BOURJOIS لاک ناخن جدید 12
8028713210013,ACQUA DI PARMA COLONIA INTENSA U EDC 50ML
3380811160108,CLARINS VITAL LIGHT DAY ILLUMINATING ANTI AGEING COMFORT CREAM 50ML-160
3052503825700,BOURJOIS مداد چشم ضد آب کلوپ 57
8011607208630,NATURAL MATT EFECT COMPACT POWDER FOUNDATION 060
3052503751030,BOURJOIS رژ گونه جدید-10
8028713240119,ACQUA DI PARMA LEATHER EDC 100ML
3052503010854,BOURJOIS برس کابوکی
8011607051403,PUPA NEW CHIC - Luminous Lipstick-136
3052503667126,BOURJOIS مداد چشم جدید-71
3052503816111,BOURJOIS خط چشم اتودی اولترا بلک 61
3052503807102,BOURJOIS ریمل حجم دهنده کلوپ-71
8011607180264,PUPA CHINA DOLL LASTING COLOR -GLOSSY NAIL POLISH 732
8011607194407,PUPA LASTING COLOR GLOSSY NAIL POLISH 519
8011607194957,PUPA LASTING COLOR GEL 51
8011607194834,PUPA LASTING COLOR GEL 39
8011607195022,PUPA LASTING COLOR GEL 58
4033651004208,BEYU مداد دوکاره چشم 408
4033651329608,BEYU رژ لب مایع کرمی 60
4033651355317,BEYU سایه سه تایی 31 CATWALK SRAR
3423470891232,NARCISO RODRIGUEZ MUSC COLLECTION HER INTENSE EDP 50 ML
3052503705149,BOURJOIS ريمل واليوم گلامورمكس دفينيشن
3605533018958,LANCOME OMBRE 5 COLOUR PALLETE HYPNOSE DOLL EYES WIDE EYES DO3
3147753630027,LANCOME BLUSH SUBTIL GENTLE & LONG LASTING PAWDER BLUSH 02
8011607112579,PUPA LASTING COLOR 5 ml-600
8426017024525,LOEWE QQQ EDP 100ML
3052503807515,BOURJOIS ریمل سوپر سیاه کننده کلوپ-75
3605532016863,LANCOME LIPSTICK NROUGE LABSOLU SPF 12-355
767418233627,LUCIANO SOPRANI UOMO SHOWER GEL 200ML
8011607211272,PUPA VIVA CARIOCA LASTING COLOR GEL DUO 003
3052503950310,BOURJOIS ریمل ابرو 03
8011607210282,PUPA I`M PURE COLOUR LIPSTICK ABSOLUTE SHINE #408
3052503735610,BOURJOIS كرم پودر هلتي ميكس جديد 56
8011607209941,PUPA I`M PURE COLOUR LIPSTICK ABSOLUTE SHINE #106
3365440665958,YSL LA LAQUE COUTURE VERNIS 22172 8
3365440118010,YSL ROUGE COUTURE VERNIS A LEVRES-861-15
3365440564145,YSL M.U EYE PENCIL - 779
3380810594102,CLARINS ACTIVE HAND CREAM MEN 75ML
3365440602274,YSL ROUGE VOLUPTE SHINE-482-18
3423474875351,ISSEY MIYAKE L'EAU D'ISSEY POUR HOMME SPORT MINT EDT 100 ML
3351500963416,AZZARO CLUB WOMAN EDT 75 ML
4051761103468,ANNY لاک ناخن 346
8411061781722,ANTONIO BANDERAS HER GOLDEN SECRET W EDT 50 ML
3760048790734,LORIENCE LULU FOREVER EDT 50 ML
3760048792387,MAUBOUSSIN ROSE POUR ELLE EDP 100ML
3380814416219,CLARINS JOLI ROUGE BRILLANT-162-13
3052503901107,BOURJOIS رژ گونه جدید-11
4033651381958,BEYU پنکیک برنزه-5
3052503738505,BOURJOIS کرم پودر موس مات کننده-85
3380814213412,CLARINS EYEBROW PENCIL-02
3508441106338,CREED IMPERIAL M 120ML
3380814411412,CLARINS JOLI ROUGE-733-114
4051761005656,ANNY لاک ناخن جدید 246.90
3365440665835,YSL LA LAQUE COUTURE VERNIS 22164 5
3365440616752,YSL M.U ROUGE PUR COUTURE-217
3365440244061,YSL PURE CHROMATICS 12
3423470311365,ISSEY MIYAKE - L'EAU D'SSEY POUR HOMME - EDT125 ML M
3052503300719,BOURJOIS مداد لب ادیشن7
3052503231327,BOURJOIS رژ لب ادیشن 13
3052503233628,BOURJOIS رژلب ادیشن 12 ساعت 36
3052503625522,BOURJOIS کرم پودر فلاور پرفکشن 55
3052503186108,BOURJOIS مداد هایلایتر زیر ابرو
4033651020192,BEYU رژلب پیور کالر150
3274872297715,KENZO L'EAU PAR KENZO POUR HOMME INTENSE M EDT 50ML
3052503625829,BOURJOIS کرم پودر فلاور پرفکشن 58
3052503758534,BOURJOIS رژ گونه جدید-85
8411061787144,CAROLINA HERRERA 212 SURF W EDT 60 ML
3423470883350,NARCISO RODRIGUEZ-ESSENCE-2011 NEW OLFACTIVE  75ML  EDT
3351500980512,AZZARO POUR HOMME LIMITED EDITION M EDT 100 ML
3137370318576,NINA RICCI NINA LES DELICE W EDT 75ML
3052503615417,BOURJOIS پودر فشرده بایودیتوکس 54
8011607175826,PUPA HOT TOPICS LASTING COLOR 5ml #408
8011607112623,PUPA LASTIN COLOR 5 ML #700
8011607146994,PUPA LASTING COLOR 5 ml-605
3052503805238,BOURJOIS ریمل توییست آپ اولترا بلک 52
3423478915756,NARCISO RODRIGUEZ FOR HER AUE DELICATE  LIMITED  EDITION EDT 125 ML
3423470883015,NARCISO RODRIGUEZ - ESSENCE EDP 50 ML W
4051761100801,ANNY لاک ناخن 80
3349668524624,PACO RABANNE BLACK XS POTION M EDT 100 ML
8011607147199,PUPA NAIL-CUTICLE NOURISHING OIL-701
3365440291201,YSL CREME DE BLUSH 9
3365440666276,YSL LA LAQUE COUTURE 22196 16
3365440063037,YSL M.U TOUCH ECLAT 1/5
3365440665750,YSL LA LAQUE COUTORE 22158 3
3365440744998,YSL BLUSH VOLUPTE-52577-02
3365440648418,YSL M.U GOLDEN GLOSS-743
3365440259089,YSL ROUGE PUR COUTURE VERNIS A LEVRES -355-22
3365440358515,YSL ROUGE PUR COUTURE 821-58
3365440332195,YSL ROUGE PUR COUTURE - 699-53
3605532868219,LANCOME GLOSS IN LOVE SPARKLING LIPGLAZE COCOONING FEEL-162
3605532692630,LANCOME TURNS PENCIL KHOL HYPNOSE WATERPROOF -02
3365440328839,YSL DESSIN DES LEVRES-420
3365440563940,YSL M.U EYE PENCIL - 774
3365440289406,YSL DESSIN DU REGARD-16
3365440309197,YSL LA LAQUE COUTURE TIE&DRY 42198 2
3365440562868,YSL M.U OMBRE SOLO-864
3605532678986,LANCOME OMBRE HYPNOSE PEARLY COLOUR HIGH FIDELITY P209
3365440259157,YSL ROUGE PUR COUTURE VERNIS A LEVRES -356-23
3365440309265,YSL LA LAQUE COUTURE TIE&DRY 42200 3
3365440263901,YSL PURE CHROMATICS 13-623
3365440648333,YSL M.U GOLDEN GLOSS-740
3605533316481,LANCOME SET DOU CONFORT GALATE CONFORT+TONIQE CONFORT 400 ML
3147758051216,LANCOME BOCAGE DEODORANT DRY DEODORANT SPRAY 125ML
3052503910611,BOURJOIS سایه چشم اینتنس 06
8435137704248,PRADA-PRADA MAN EDT 50ML
3052503800103,BOURJOIS ریمل ولومایزر 1
3052503705118,BOURJOIS ریمل والیوم گلامورمکس 51
3052503941318,BOURJOIS سایه چشم سه تایی جدید 13
3274872289604,KENZO L'EAU PAR KENZO INTENSE W EDP 50ML
8028713570049,ACQUA DI PARMA BM MANDORLO U EDT 150ML
8011607214044,PUPA COVER CREAM CONCEALER-CREAM CONCEALER 006
3052503155302,BOURJOIS کرم پودر AIRMAT53
783320402517,BVLGARI MON JASMIN NOIR W EDP 75ML
3508441001480,CREED ACQUA ORIGINALE VETIVER GERANIUM 100ML
4033651001337,BEYU مداد دوکاره چشم324
3760209750010,OLFACTIVE STUDIO AUTOPORTRAIT EDP 100ML
3380814416318,CLARINS JOLI ROUGE BRILLANT-163-14
8437011481146,CARNER CHRISTMAS SET TARDES 50ML + RIMA 50ML
8028713430015,ACQUA DI PARMA IRIS NOBILE SUBLIME U EDP 75ML
3508441104631,CREED AQUA FLORENTINA 75ML
8437011481016,CARNER TRADES  U EDP 50ML
3052503824703,BOURJOIS مداد چشم ضدآب كلوپ 47
8011607213054,PUPA VIVA CARIOCA LIKE A DOLL LUMINYS BLUSH 107
3052503521411,BOURJOIS رژ لب مایع 8 ساعته 14
3052503824802,BOURJOIS مداد چشم ضدآب كلوپ 48
3614270551529,YSL BLACK OPIUM W EDT 50 ML
3365440690875,YSL MANIFESTO LECLAT W EDT 50 ML
677385968395,DAVID YURMAN LIMITED EDITION BLACK W EDP 75 ML
3380810046229,CLARINS SET RICH BODY LOTION200ML HAND&NAIL TREATMENT CREAM 50MLEXFOLATING BODY FOR SMOOTH SKIN 30ML
3423478922952,NARCISO RODRIGUEZ FOR HER GLITTERS & RIBBONS WITH AUTOMIZER LTD EDP 75 ML
3423473948353,ISSEY MIYAKE PLEATS PLEASE W EDP 100 ML
8435137732494,PRADA LUNA ROSSA COLLECTOR M EDT 100ML
3346470200005,GUERLAIN-L'INSTANT POUR HOMME EDT M 75ML
8411061803950,VALENTINO VALENTINA PINK W EDP 80ML
3052503703121,BOURJOIS ریمل پوش آپ اولترا بلک
3052503757438,BOURJOIS رژ گونه جدید-74
3052503231426,BOURJOIS رژ لب ادیشن 14
4051761100658,ANNY لاک ناخن  65
3380810046144,CLARINS SET COLLECTION HYDRAQUINCH+CREAM NORMAL TO DRY SKIN 50ML+SWRUM BI-PHASE15ML+CREAM MASK 15ML
3508441001466,CREED ACQUA ORIGINALE IRIS TUBEREUSE 100ML
3760209750034,OLFACTIVE STUDIO CHAMBRE NOIRE EDP 100ML
701666312055,AMOUAGE MAN REFLECTION EDP 100ML
3052503300115,BOURJOIS مداد لب ادیشن1
3052503667225,BOURJOIS مداد چشم جدید-72
767418216514,LUCIANO SOPRANI SOLO BLU UNISEX EDT 50ML
3380811065106,CLARINS EXTRA FIRMING DAY CREAM SPECIAL FOR DRY SKIN 50ML
679602791083,ZIPPO THE WOMAN EDP 75 ML
3516641001629,FRANCK OLIVIER POUR ELLE W SPRAY 200ML
3439600458817,THIERRY MUGLER ANGEL BODY GEL 100ML
737052596983,HUGO BOSS RED M EDT 150ML
88300187409,CALVIN KLEIN EUPHORIA M EDT 30ML
3439602851913,THIERRY MUGLER ALIEN BODY GEL 100ML
88300178322,CALVIN KLEIN EUPHORIA M EDT 50ML
88300162550,C.K EPHORIA W 50ML
3351500999019,AZZARO POUR HOMME NIGHT TIME EDT 30ML
737052320090,HUGO MEN EDT 150ML
3516641011628,FRANCK OLIVIER SUN JAVA FOR MEN SPRAY 200ML
737052483214,LACOSTE ESSENTIAL EDT 125ML
3351500981700,AZZARO POUR HOMME  M EDT 30ML
3351500980802,AZZARO POUR HOMME  M  EDT 50ML
679602701068,ZIPPO M EDT 50ML
737052347974,BOSS ORANGE MAN EDT 100ML
737052339047,GUCCI GUILTY M EDT 90ML
3326240003852,ULRIC DE VARENS BLUE M EDT 100ML
737052132662,GUCCI BY GUCCI EDP W 75 ML
3607342401389,CALVIN KLEIN ONE SHOCK EDT 50ML
3516640917112,FRANCK OLIVIER BLACK TOUCH M EDT 100ML
3351500996025,AZZARO PH L EAU EDT 100 ml
679602398107,POLICE BLUE DESIRE W EDT 75ML
3770002237120,PAUL VESS BLACK STORY M EDT 100ML
737052466873,LACOSTE CHALLENGE RE FRESH M EDT 90
3607342306417,CALVIN KLEIN SHEER BEAUTY W EDT 50ML
3326240816698,ULRIC DE VARENS FOR MEN M EDT 100ML
3516641017637,FRANCK OLIVIER WHITE TOUCH W SPRAY 200ML
3351500999026,AZZARO POUR HOMME NIGHT TIME EDT 50ML
3516641111632,FRANCK OLIVIER SUN JAVA WHITE W SPRAY 200ML
8300186908469,SERGIO TACCHINI O.ZONE W EDT 75ML
85715135025,BEBE W EDP 10ML
85715414243,BANANA REPUBLIC MALACHITE W EDP 100ML
3516641111625,FRANCK OLIVIER SUN JAVA WHITE M SPRAY 200ML
3607345504117,CHLOE LEAU EDT 50ML
737052525204,GUCCI GUILTY EDT INTENSE 100ML
3607340216008,CALVIN KLEIN BEAUTY W EDP 50ML
3349668111343,PACO RABANNE XS EXCESS POUR HOMME EDT 100ML
3607348541812,CALVIN KLEIN ENCOUNTER M EDT 30ML
783320962516,BVLGARI-OMNIA GREEN JADE EDT W 65ML
679602761062,ZIPPO INTO THE BLUE EDT 50ML
85715294265,BROOKS BROTHERS CLASSIC EDC 100ML
3439600666090,THIERRY MUGLER  A*MAN RECHARGABLE  EDT 100ML
3607342161740,MARC JACOBS BANG EDT 50ML
3351500996018,AZZARO PH L EAU EDT 50 ml
3351500802012,PORSCHE DESIGN TITAN EDT M 50ML
3607348541737,CALVIN KLEIN ENCOUNTER M EDT 50ML
3351500800636,PORSCHE DESIGN ESSENCE EDT 50ML
3516641225124,FRANCK OLIVIER IN BLACK M EDT 75ML
3605473326083,BENETTON LETS LOVE WOMAN EDT 100ML
3516640825127,FRANCK OLIVIER EAU DE PASSION MEN 75ML
3439602800313,THIERRY MUGLER ALIEN POWER OF GOLD EDP 60ML
3607342044678,MARC JACOBS LOLA EDP 50ML
3439600625097,THIERRY MUGLER A RUBBERY M  EDT 50ml
3516649401384,FRANCK OLIVIER W EDP 7.5ML
3439601000312,THIERRY MUGLER WOMANITY W EDP 50ML
3439600603019, THIERRY MUGLER ANGEL MEN GOLD EDITION REFIL EDT 100ML
8411061602522,CAROLINA HERRERA 212 SEXY MEN EDT 100ML
679602701259,ZIPPO THE ORIGINAL SILVER EDT 30ML
3439600633092,THIERRY MUGLER ANGEL M EDT 30ML
3605473198710,JOHN GALLIANO BEFORE MIDNIGHT EDT 50ML
679602731256,ZIPPO ON THE ROAD EDT 30ML
3607342350328,MARC JACOBS BANG BANG EDT 50ML
3605470205213,BENNETON GIALLO WOMAN  EDT 100ML
8411061545904,CAROLINA HERRERA 212 SEXY W EDP 100ML
3770002237007,PAUL VESS PARIS LA NUIT M EDT 100ML
8300186901057,SERGIO TACCHINI CLASSIC M EDT 100ML
8300186901040,SERGIO TACCHINI CLASSIC M EDT 50ML
3326240004958,ULRIC DE VARENS BEST M EDT 100ML
3516641232122,FRANCK OLIVIER BAMBOO M EDT 75ML
3439609000215,SWAROVSKI ALCOHOL REGULAR REFILL EDP 50ML
3326240019228,ULRIC DE VARENS EXTREME M EDT 100ML
8411061251607,CAROLINA HERRERA 212 NYC W EDT 100 ML
3605473198451,BENNETON LETS MOVE MAN 100ML
3516641225131,FRANCK OLIVIER IN BLACK M EDT 50ML
8002135078857,LA PERLA J'AIME LA NUIT EDP 50ML
85715294258,BROOKS BROTHERS 1818 EDC 100ML
85715302656,BROOKS BROTHERS GENTLEMEN EDT 100ML
3326240018634,ULRIC DE VARENS BLACK M EDT 100ML
737052598079,DOLCE&GABBANA POUR FEMME EDP 100ML
3605473198185,BENETTON COLD M EDT 100ML
3326240021696,ULRIC DE VARENS ACTION M EDT 100ML
3770002237014,PAUL VESS PARIS LA NUIT W EDP 100ML
8002135074125,SERGIO TACCHINI BE.ST W EDT 100ML
3516641232139,FRANCK OLIVIER BAMBOO M EDT 50ML
8002135084940,SERGIO TACCHINI PINK W EDT 30ML
679602712552,ZIPPO THE ORIGINAL BLUE EDT 30ML
3607342349117,MARC JACOBS BANG BANG EDT 30ML
85715135001,BEBE  WMN  EDP 100ML
3516640511129,FRANCK OLIVIER SUN JAVA FOR MEN W EDP 75ML
3516640825325,FRANCK OLIVIER NATURE W EDP 75ML
3605473176756,ICEBERG POUR FEMME EDT 100ML
3516641030124,FRANCK OLIVIER SUNRISE M EDT 75ML
8002135097421,FERRARI BLACK SHINE 125 ML
3439602803813,THIERRY MUGLER ALIEN AQUA CHIC W EDT 60ML
82984000900,ROYAL PLATINUM 90 M EDT 100ML
679602761253,ZIPPO INTO THE BLUE EDT 30ML
3605470205206,BENNETON BLU MAN EDT 100ML
3516641030148,FRANCK OLIVIER SUNRISE M EDT 50ML
3439600229219,THIERRY MUGLER ANGEL AQUA CHIC W EDT 50ML
85715411310,BANANA REPUBLIC ALABASTER W EDP 100ML
85715135063,BEBE  SHEER EDP 90ML
3516640511136,FRANCK OLIVIER SUN JAVA FOR MEN W EDP 50ML
3605470204346,BENNETON VERDE MAN EDT 100ML
3770002237083,PARFUME DE STYLE L'HOMME M EDT 100ML
85715135216,BEBE WISHES & DREAMS W EDP 100ML
3516641233136,FRANCK OLIVIER BAMBOO AMERICA M EDT 50ML
3439600191011,THIERRY MUGLER ANGEL EDT 40 ML
85715495006,BROOKS BROTHERS MADISON W EDP 100ML
85715135155,BEBE GOLD W EDP 100ML
3326240002466,ULRIC DE VARENS CHIC-ISSIME W EDP 30ML
3516641233129,FRANCK OLIVIER BAMBOO AMERICA M EDT 75ML
3516641030346,FRANCK OLIVIER SUNRISE W EDT 30ML
3516640925124,FRANCK OLIVIER PASSION MEN EDT 75ML
3516640917334,FRANCK OLIVIER WHITE TOUCH W EDP 50ML
3605473176749,ICEBERG POUR HOMME EDT 100ML
3770002237069,PAUL VESS BLACK SPORT M EDT 100ML
3516641011338,FRANCK OLIVIER SUN JAVA WHITE M EDT 50ML
679602712538,ZIPPO THE ORIGINAL GREEN EDT 30ML
82984258110,ROYAL PLATINUM 71 W EDP 100ML
8300186901033,SERGIO TACCHINI CLASSIC M EDT 32ML
679602712545,ZIPPO THE ORIGINAL PINK EDT 30ML
3516641030322,FRANCK OLIVIER SUNRISE W EDT 75ML
3516640525355,FRANCK OLIVIER PASSION W EDP 25ML
3516649401322,FRANCK OLIVIER W EDP 75ML
737052780382,LACOSTE LIVE POUR HOMME EDT 100 ML
737052238128,BOSS ORANGE EDT 75 ML
5045233404831,BURBERRY THE BEAT FOR WOMEN EDT 100ML
3516640925131,FRANCK OLIVIER PASSION MEN EDT 50ML
3414200812016,DAVIDOFF SILVER SHADOW EDT 100 ML M
3605473406464,ICEBERG BURNING ICE EDT MEN 100 ML
3516641011321,FRANCK OLIVIER SUN JAVA WHITE M EDT 75ML
3414200204415,DAVIDOFF ADVENTURE EDT 100 ML
85715801715,DUNHILL DESIRE BLACK EDT 100ML
3607344163773,DAVIDOFF HOT WATER EDT 100 ML
729986125001,JORDACHE WHITE DIAMONDS W EDP 90ML
8018365071469,VERSACE CRYSTAL NOIR W EDT 90ML
3516641030339,FRANCK OLIVIER SUNRISE W EDT 50ML
729986126008,JORDACHE UNISEX CK ONE EDT 90ML
3439601200118,THIERRY MUGLER WOMANITY EAU POUR ELLE EDT 50ML
729986129504,JORDACHE MEN POLO BLACK EDT 90ML
85715302717,BROOKS BROTHERS LADIES EDP 100ML
8002135080461,LA PERLA J'AIME LES FLEURS EDT 50ML
3414200150026,STILL - JENIFER LOPEZ W 100ML
3516640525386,FRANCK OLIVIER PASSION W EDP 7.5ML
88300107407,CALVIN KLEIN ONE  EDT 100 ML
737052514079,DOLCE & GABBANA THE ONE SPORT EDT M 100ML
8300186905581,SERGIO TACCHINI DONNA W EDT 30ML
737052714028,HUGO BOSS JUST DIFFERENT EDT 125ML
3351500954247,AZZARO CHROME LEGEND  M EDT 125ML
88300105519,CALVIN KLEIN ETERNITY EDT 100ML
3605473406471,ICEBERG BURNING ICE EDT MEN 50 ML
3326240000950,ULRIC DE VARENS POUR ELLE W EDP 30ML
737052351100,BOSS HUGO BOSS EDT 100ML
8002135062672,SERGIO TACCHINI FEEL GOOD M EDT 100ML
737052683553,HUGO DEEP RED EDP 90ML W
8002135062658,SERGIO TACCHINI FEEL GOOD M EDT 50ML
8002135084926,SERGIO TACCHINI PINK W EDT 50ML
5045379571534,BURBERRY SPORT MAN EDT 75ML
737052041353,BOSS FEMME EDP 75ML
8002135066113,SERGIO TACCHINI FEEL GOOD M EDT 30ML
3516641011123,FRANCK OLIVIER SUN JAVA WHITE W EDP 75ML
8002135062832,SERGIO TACCHINI FEEL GOOD W EDT 100ML
3386460048118,JIMMY CHOO FLASH EDP 100ML
82984001266,ROYAL PLATINUM 126 M EDT 100ML
8002135069367,FERRARI UOMO EDT 100ML
8002135062771,SERGIO TACCHINI FEEL GOOD W EDT 30ML
8411061607152,HERRERA  CH EDT W 100 ML
3386461515671,LANVIN ECLAT W 100ML
3516640511327,FRANCK OLIVIER SUN JAVA FOR WOMEN W EDP 75ML
3607342044494,MARC JACOBS LOLA EDP 30ML
4084500357150,HUGO BOSS NUMBER ONE M EDT 125ML
5045415436919,BURBERRY BRIT RHYTHM WOMEN EDT 90ML
82984258332,ROYAL PLATINUM 47 M EDT 100ML
3516640501335,FRANCK OLIVIER BLUE W EDP 50ML
729986125704,JORDACHE POLO SPORT M EDT 90ML
8002135080485,LA PERLA J'AIME LES FLEURS EDT 30ML
8011003999620,VERSACE VANITAS  W EDP  100ML
82984258639,ROYAL PLATINUM 57 W EDP 100ML
3605470204353,BENNETON ROSSO WOMAN EDT 100ML
3439609000314,SWAROVSKI ALCOHOL REGULAR REFILL EDP 75ML
3516640501328,FRANCK OLIVIER BLUE W EDP 75ML
82984000870,ROYAL PLATINUM 87 M EDT 100ML
3516641030384,FRANCK OLIVIER SUNRISE W EDT 7.5ML
82984000696,ROYAL PLATINUM 69 M EDT 100ML
729986127203,JORDACHE MEN PACO EDT 90ML
3326240005115,ULRIC DE VARENS GOLD-ISSIME W EDP 30ML
3516640511334,FRANCK OLIVIER SUN JAVA FOR WOMEN W EDP 50ML
8300186908322,SERGIO TACCHINI O.ZONE M EDT 75ML
82984258011,ROYAL PLATINUM 05 W EDP 100ML
82984258264,ROYAL PLATINUM 40 M EDT 100ML
82984000146,ROYAL PLATINUM 14 W EDP 100ML
729986126305,JORDACHE NO5 W EDP 90ML
3760048792417,LORIENCE LULU CASTAGNETTE BLUE W EDP 50 ML
715387003000,BENETTON HOT W EDT 100ML
729986125308,JORDACHE MEN DAKKAR NOIR EDT 90ML
8002135084964,SERGIO TACCHINI PINK W EDT 100ML
8300186908445,SERGIO TACCHINI O.ZONE W EDT 50ML
3516641232337,FRANCK OLIVIER BAMBOO W EDT 50ML
8002135048126,SERGIO TACCHINI STILE DONNA W EDT 75ML
3439601000213,THIERRY MUGLER WOMANITY W EDP 30ML
