Barcode,ItemName
4033651388476,BEYU کرم پودر MINERAL -7
20714312923,Clinique Fresh Bloom Allover Colour Poudre Eclat Floral
6260664105518,YVES ROCHER شامپو بدن هلو
4005808283774,اسپری ضد آفتاب با پوشش نامرئی 30SPF 30 میل
3052503282121,BOURJOIS چشم پاک کن قوی -  دو فاز
8011003995943,VERSACE P.H  M EDT 30 ML
3600520966694,L'OREAL رنگ مو بزرگ 4/25
9666920,ORLY taffy   406690
20714276508,CLINIQUE PORTABLE COLOR
8009518114652,DEBORAH AGE RESET FOUNDATION 1
737052001210,L.B.I L.B.H DUE DONNA EDP 50ML^*
8011003998210,VERSACE  VERSUS W EDT 30ML
6260664108533,YVES ROCHER لوسیون پاک کننده 1*2
3760048933025,کلو وکلايو و ميس کورول عطريات ميس کورول ادو توالت فلاور 60ml
20714235338,6FKW010000
2629940018241,DMGM رژ لب ژله ای حجم دهنده 14
3432240024237,CARTIER EAU DE CARTIER EDT M 100ML
3052505011910,UNE يون رژ لب مايع 19
3760048931021,کلو وکلايو و ميس کورول عطريات کلو کلاسيک ادو سنتور کلو لي لي بلو
4033651388056,BEYU کرم پودر MINERAL -05
3760048933018,کلو وکلايو و ميس کورول عطريات ميس کورول ادو توالت چري 60ml
3432240008435,CARTIER LE BAISER DU DRAGON EDP 50ML
3760048930796,کلو وکلايو و ميس کورول عطريات کلو 1.2.3 عطر کلو 2
637294068616,V.SECRET  SHEA BUTTER SOFT EMBRACE BODY MIST 250 ML
6260664103576,YVES ROCHER آرنيكا اسانسيل كرم تقويت و نرم كننده دست و ناخن
4033651936653,BEYU کیت سایه چشم چهار تایی-65
3352818307053,KENZO L'EAU PAR KENZO ICE EDT M 50 ML
3052505250210,UNE يون ريمل کژوال واليوم  2
4005808868032,اسپری نگهدارنده مو 250میل
8009518163117,DEBORAH PEACH FLOWER FRENCH
3052505200239,UNE يون ريمل بلند کننده اسمارت 2
4033651351135,BEYU سایه چشم تک-113
4005808195282,نیوا شیر پاک کن قوی 200 میل
3577581000035,BOUCHERON P.F JEW SECRET EDT 100ML
3365440648371,YSL M.U GOLDEN GLOSS-742
2629940018258,DMGM رژ لب ژله ای حجم دهنده 15
20714303457,6L26040000
20714235871,6FLK070000
4019674346662,ARTDECO سایه مینرال 66
3346131610952,HERMES 24 FABOURG EAU DELICATE EDT 50ML
3760048930789,کلو وکلايو و ميس کورول عطريات کلو 1.2.3 عطر کلو 1
3760048932479,کلو وکلايو و ميس کورول عطريات کلايو ست ادو توالت دخترانه 100ml همراه با شامپو
4005808868247,ژل آکوا حالت دهنده مو
6260664102227,YVES ROCHER فيتوم انرژي شامپو درخشان كننده 3*1
6260664104672,YVES ROCHER پودر كلميل شير پاك كن لوسيون 2*1
88300196913,CK IN2U M 50ML
6260664104955,YVES ROCHER سایر پاک کننده چشم اکسپرس
3365440353046,YSL M.U ROUGE PUR SHINE-930
3052503471815,BOURJOIS رژ لب مایع مرطوب کننده-18
4005808195145,شیر پاک کن و باز سازی پوست 200 میل
4019674040287,ARTDECO یدک پن کیک ابریشمی 28
737052098739,BOSS IN MOTION ELECTRIC EDT 90ML
4033651342201,BEYU مداد لب کت واک-20
3577580000036,BOUCHERON B7 EDP 100ML
3365440341418,YSL M.U TRAVEL SELECTION MASCARA ALL FOR GLAMOUR-214
3432240013873,CARTIER MUST DE CARTIER EDT 30ML W
27131782087,ESTEE LAUDER ADVENTUROUS EDP 50 ML
6260664105655,YVES ROCHER ماسك هاي سه دقيقه اسكراب صورت ذرات هسته زرد آلو
3365440353244,YSL M.U ROUGE VOLUPTE-004
4005808195862,نیوا چسبهای تمیز کننده جوش
4033651388421,BEYU کرم پودر MINERAL -2
3365440069275,YSL  JAZZ  M  EDT 50ML
3274870372155,GIVENCHY ANGE OU ETRANGE EDT 50 ML
3365440288300,YSL M.U ROUGE PURE SHINE-901
8010573372956,NOUBA LIP STICK 295
3052503920306,BOURJOIS سایه چشم تک-3
8009518162936,DEBORAH STRENGHTINIG BASE
3365440290273,YSL M.U SKIN CARE CLARTE EXTREME CREME-308
737052232188,HUGO ELEMENT MAN EDT 60ML
3419020265400,MASAKI MATSUSHIMA M;O C - M EDT 40ML
3760048932578,کلو وکلايو و ميس کورول عطريات مائل ست ادو توالت مائل کور50ml همراه با کيف قلبي
6260664107994,YVES ROCHER ژل پاک کنند ه
4005808213108,کرم ضد آفتاب و چروک دی ان ایچ 50 میل
6260664103378,YVES ROCHER اكتيو سنستيو كرم مرطوب كننده و تسكين دهنده روز
4005808817658,فوم اصلاح فرش 200 میل
3365440246010,YSL M.U NAILS LA LAQUE- 812
3760048790130,LORIENCE LULU INDOMTEE EDT 100 ML
8015150101615,COLLISTAR PERFECT NAIL ENAMEL-161-31
3760048930963,کلو وکلايو و ميس کورول عطريات کلو لوليز عطر پسرانه
20714288655,CLINIQUE LASTING LIP TRIO
3600520432878,L'OREAL شامپو 250 میل نوتری سرامید
6260664108519,YVES ROCHER شیر پاک کن نوتری
6260664103767,YVES ROCHER کرم ضد چروک روز
3386460018487,BURBERRY SPORT W EDT 75ML
4033651356758,BEYU استیک سایه چشم-75
4033651381569,BEYU استیک برنزه-6
8004608104889,COMFORTZONE REBALLANCE SKIN RESONANCE PEELING 50ML-63
3760048932530,کلو وکلايو و ميس کورول عطريات کلايو ست ادو توالت دخترانه100mlهمراه با فلاسک
4019674401224,ARTDECO پن کیک ابریشمی آینه دار 22
8010573322227,NOUBA APPLICATOR LIP PENCIL 22
6260664104719,YVES ROCHER لوسیون تسکین دهنده
3423470860016,JEAN PAUL GAULTIER -GAULTIER 2 - EDP 80 ML M
3346470106673,GUERLAIN INSOLENCE 08 L-E 180 YEARS  EDT W 50 ML
4005808198740,کرم ضد چروک دور چشم حاوی Q10
4019674013892,ARTDECO رژ لب پرفکت 89
4005808195237,پاک کننده ملایم آرایش چشم 125 میل
2355434533333,لبا
2629940023740,DMGM لاک ناخن متالیک 08
766124069605,GUCCI EDP II EDT M 50 ML
3760048932400,کلو وکلايو و ميس کورول عطريات مائل ست ادو توالت مائل کور100ml
6267680000391,YVES ROCHER شامپو استحکام بخش و حجم دهنده 66498
737052146393,MONT BLANC HOMME EXCEPTIONNEL EDT M 50 ML
6260664101213,YVES ROCHER ژل پاک کننده عمقی
6260664104689,YVES ROCHER پودر كلميل لوسيون تونر فلورال
3432240008442,CARTIER LE BAISER DU DRAGON EDP 30ML
8015150151221,COLLISTAR SILK EFFECT EYE SHADOW -122
3419020270404,MASAKI PARIS W EDP 40 ML
8009518162967,DEBORAH WHITENING BASE
4033651352637,BEYU سایه چشم تک-263
4019674034125,ARTDECO پودر پایه مینزال 12
8007033783148,BYBLOS MAN M EDT 100 ML
8007033783131,BYBLOS MAN M EDT 50 ML
2629940023863,DMGM لاک ناخن صدفی 03
3365440071537,YSL  LIVE JAZZ  M  EDT 100ML
3365440305748,YSL M.U GOLDEN GLOSS-725
2629940016896,DMGM مداد لب حرفه ای 09
4019674035030,ARTDECO پودر ابریشمی تثبیت 03
4019674514252,ARTDECO بیوتی باکس چهار تایی252
3365440109926,YSL M.U MASCARA AQUARESISTANT-644
3052503738703,BOURJOIS کرم پودر موس مات کننده-87
4003349028281,NAIL POLISHER
3052503281308,BOURJOIS کرم لایه بردار پوست-ویتامینه
3419020270800,MASAKI PARIS W EDP 80 ML
4019674565278,ARTDECO پودر صورت گلام استار
6267680000520,YVES ROCHER شیر نرم کننده و حالت دهنده ( بعد از شامپو ) 68477
6260664103798,YVES ROCHER کرم ضد چروک
3346470301177,GUERLAIN HABIT ROUGE COLLECTOR EDP M 100 ML
3365440071155,YSL  LIVE JAZZ  M  EDT 50ML
4033651326485,BEYU رژ لب STAR -48
6260664102104,YVES ROCHER فيتوم انرژي شامپو انرژي دهنده مو
6260664108410,YVES ROCHER هيدرا اسپسيفيك كرم مرطوب كننده عمقي شب سو
4033651032621,BEYU رژ لب کت واک- 62
6260664103750,YVES ROCHER ريچ كرم ضد چروك دور چشم
4005808198771,ویتال کرم باز سازی کننده شب
2629940017671,DMGM برق لب کریستالی حجم دهنده 02
603531630007,BIJAN W EDT 50ML
6260664101879,YVES ROCHER فيتوم رفله شامپو موهاي قهوه اي
6260664108540,YVES ROCHER فوم  کرمی پاک کننده
8015150154567,COLLISTAR EYE SHADOW LUMINES POWDER456
8009518121698,DEBORAH MONO HI TECK EYE SHODOW 63
8009518114676,DEBORAH AGE RESET FOUNDATION 2
4003349077074,BARBERS SHEARS STAINLESS STEEL 16CM
3386461206630,S.T. DUPONT POUR HOMME EDT 100 ML
4019674486184,ARTDECO کرم پودر هیدرا 18
3365440288126,YSL M.U TEINT COMPACT HYDRA FEEL-466
4003349076992,SCISSORS STAINLESS STEEL 10CM
6260664105419,YVES ROCHER فيتوم آنتي شوت شامپو اسطوخودوس
3386461038330,S.T.DUPONT NOIR EDT M 50 ML
8010573213105,NOUBA MASCARA NOUBAMATHICK W.P
3760048932349,کلو وکلايو و ميس کورول عطريات کلايو عطر کلايو  گرل
4019674305829,ARTDECO سایه چشم 582
4005808296378,ویساژ کرم نگهداری روزانه زیبایی 50 میل
3760048932554,کلو وکلايو و ميس کورول عطريات کلايو ست ادو توالت دخترانه50ml همراه با کيف گلي
3760048932486,کلو وکلايو و ميس کورول عطريات مائل ست ادو توالت مائل کور با هديه
6260664104733,YVES ROCHER بيو اسپسيفيك هيدرا وايت فلويد سفيد كننده و مرطوب كننده spf 25
4019674017791,ARTDECO خط لب 779
3530013501692,PHYTOMER کرم ضد چروک و افتادگی SVV   172
4019674113028,ARTDECO لاک با برس مخصوص 02
6267680000421,YVES ROCHER کرم ضد چروک روز  73952
3760048930017,کلو وکلايو و ميس کورول عطريات کلو کلاسيک عطر کلو بلو
6260664108403,YVES ROCHER کرم تغذیه کننده شب
3365440002173,YSL  PARIS  W EDT 75ML
8010573371782,NOUBA LIP STICK 178
4033651353917,BEYU سایه چشم تک-391
3605470204094,BENNETON POP ENERGY W EDT 100 ML
4033651366023,BEYU خط چشم مایع-2
3760048931243,کلو وکلايو و ميس کورول عطريات کلو کلاسيک ست عطر کلو لي لي بلو (ميني ميس)
3365440650855,YSL M.U CREME DE BLUSH 2
8007033783957,BYBLOS ESSENCE W EDP 50 ML
3760048932035,کلو وکلايو و ميس کورول عطريات مائل ادو توالت مائل فلور 100ml
9618127,ORLY mini razzma tazz   486710
98691045448,JUICY COUTURE DIRTY ENGLISH EDT 100 ML P.H
8009518116342,DEBORAH D SHADOW 11
737052271958,DUNHILL 51.3 N EDT 100ML
3365440334342,YSL M.U ROUGE PUR SHINE-922
6260664101954,YVES ROCHER فيتوم رفله شامپو سنتوره
3760048930826,کلو وکلايو و ميس کورول عطريات کلو 1.2.3 ست عطر کلو 2
3346470109698,GUERLAIN HABIT ROUGE 09 SPORT EDT M 100 ML
637293043317,V.SECRET  ENDLESS LOVE BODY MIST 250 ML
3760048932431,کلو وکلايو و ميس کورول عطريات کلايو ادو توالت پسرانه 100ml همراه با جعبه کار
6260664107987,YVES ROCHER پودر كلميل اسكراب ملايم
6260664103651,YVES ROCHER کرم باز سازی کننده عمقی
6260664103682,YVES ROCHER ريچ كرم ضد چروك روز
637293040378,V.SECRET  MY DESIRE BODY LOTION 250 ML
2629940024259,DMGM سایه چشم پنج رنگ 31
8002135070240,FERARI LIGHT ESSENSE 75ML EDT
8011003101405,A.D.A IN ROSE W DEO SPRAY 50ML
3365440322332,YSL M.U SKIN CARE TEMP MAJOUR NIGHT ELIXIR-397
8010573234100,NOUBA COMPACT FOUNDATION 10
3386460018630,BURBERRY SPORT M EDT 75ML
6260664101817,YVES ROCHER شامبو ضد ریزش مو
3365440353985,YSL M.U EYE SHADOW QUATOUR-265
3365440222397,YSL M.U TONING&CLEANSING DEMAQ 200ML-201
4019674043639,ARTDECO برنزه کننده دور چشم
3760048931434,کلو وکلايو و ميس کورول عطريات ناتورال عطر پسرانه 100ml
8009518112917,DEBORAH VOLUME & LIP PLUMPER 07
9670321,ORLY point blanch   425030
6260664104740,YVES ROCHER اينوزيتول وژتال لوسيون پاك كننده و ضد كدري 2*1
3700101300678,MAUBOUSSIN M EDT 50ML*
4005808283491,اسپری ضد آفتاب با پوشش نامرئی 200SPF 20 میل
8015150200318,COLLISTAR COMPACT MATTE-FINISH FOUNDATION-031
6260664108564,YVES ROCHER سبو اسپسيفيك كرم لايه بردار ملايم و تنگ كننده منافذ باز
88300196845,CK IN2 SHE  100ML
4003349025723,LADY-NAIL FILE WHITE AND TORT (16CM) 1
4019674034217,ARTDECO کانسیلر مینرال 21
4045787104417,IGORA ROYAL ABSOLUTES 6-07
3365440305199,YSL M.U ROUGE PUR SHINE-915
8011003995509,"VERSACE L""HOMME M EDT 50ML"
9640320,ORLY PEEL HERE 44162
3052503668130,BOURJOIS مداد چشم دو طرفه سفید و مشکی81
6260664103446,YVES ROCHER پودر كلميل كرم مرطوب كننده روز و شب كاسه اي
6260664104559,YVES ROCHER فلوئید ضد چروک /سفید کننده و محافظSPF30
2629940023870,DMGM لاک ناخن صدفی 04
4045787042085,IGORA ROYAL 9-5
6260664103316,YVES ROCHER اد ان وايت فوم پاك كننده و روشن كننده
3052505222101,UNE يون سايه چشم اسفوماتو  21
6267680000469,YVES ROCHER کرم ضد چروک دور چشم 74831
6267680000452,YVES ROCHER کرم ضد چروک عمقی و سفت کننده 71375
8004608101215,COMFORTZONE D-AGE BODY CREAM 200ML-17
3760048930239,کلو وکلايو و ميس کورول عطريات کلو کلاسيک عطر کلو لي لي رز
4019674346587,ARTDECO سایه مینرال 58
8010573022707,NOUBA LIP PENCIL 70
737052123837,ESCADA S VAPO EDP W 50 ML
9604726,ORLY SUPER NATURAL 40392
20714287047,6KAK010000
3760048931601,کلو وکلايو و ميس کورول عطريات کلو کلاسيک ست ادو سنتور کلو لي لي رز با هواپيما
20714303655,Clinique Supermoisture Makeup
20714235819,Clinique Blushing Blush Powder Blush Fard a Joues Poudre
4019674197455,ARTDECO تقویت و مرطوب کننده 55
4019674790120,ARTDECO BEAUTY HIGHLIGHTS
8009518115970,DEBORAH STRONG SHINE AND COLOUR O2
3365440313668,YSL S HYDRATING CREAM 50ML-1100375
40457870,OXIDAN 6% 60 ML
8010573227522,NOUBA BLUSH ON BUBBLE 52
4033651353641,BEYU سایه چشم تک-364
3346131620050,HERMES 24 FABOURG EAU DELICATE EDT 100ML
4003349085444,كنار زن كوتيكول مدل 280
22548237564,DKNY GOLDEN DELICIOUS EDP 100ML
8411061704561,HERRERA  212 EDT 60ML+SBAG MD10
3365440121751,YSL M.U OMBRE VIBRATION DUO-515
3348900531437,DIOR J ADORE EDT 100ML
3760048931045,کلو وکلايو و ميس کورول عطريات کلو کلاسيک ست عطر کلو لي لي بلو
3351500800629,PORSCHE DESIGN SUMMER ICE EDT 80ML
20714235352,6FKW030000
8009518116038,DEBORAH NAIL POLISH 7DAY LONG 824
3760048931526,کلو وکلايو و ميس کورول عطريات کلو کلاسيک ست ادو سنتور کلو لي لي رز 50ml
737052271989,DUNHILL 51.3 N EDT 50ML
3760048930758,کلو وکلايو و ميس کورول عطريات کلو کلاسيک ست عطر کلو دراژه
6260664105457,YVES ROCHER ژل دوش ماکسی
4019674111307,ARTDECO لاک ناخن سرامیکی 30
20714303648,6JPK100000
3760048930031,کلو وکلايو و ميس کورول عطريات کلو کلاسيک عطر کلو دراژه
4005900012630,لوسیون سفت کننده بدن 250 میل
2629940013314,DMGM رژ لب ژله ای حجم دهنده 08
8010573362544,NOUBA RAINBOW EYELINER 54
8032529116667,FERRAGAMO INC HEAVEN100ML EDT
737052655369,HUGO PURPLE EDP 50ML W
3760048930833,کلو وکلايو و ميس کورول عطريات کلو 1.2.3 ست عطر کلو 3
3760048930819,کلو وکلايو و ميس کورول عطريات کلو 1.2.3 ست عطر کلو 1
4033651032492,BEYU رژ لب کت واک- 49
3439602100219,THIERRY MUGLER MIROIR DES ENVIES EDP 50ML
3760048931519,کلو وکلايو و ميس کورول عطريات کلو کلاسيک ست ادو سنتور کلو بلو 50ml
4033651312365,BEYU لاک ناخن-236
3600521118801,L'OREAL شیر پاک کن کشمیر 150 میل
4033651351005,BEYU سایه چشم تک-100
3352810087823,KENZO-L'EAU PAR KENZO-NEW PACKAGE W  30ML
8009518115963,DEBORAH STRONG SHINE AND COLOUR O1
3282779169257,GALENIC کرم آرگان پوست خشک
4019674333426,ARTDECO رژ لب مینرال 42
20714245689,6GAP010000
8004608151579,COMFORTZONE ABSOLUTE PEARL CREAM 50ML-10171
6260664105389,YVES ROCHER شامپو درخشان کننده 300ML
3365440289499,YSL M.U TOUCH BRILLANCE-822
4033651353733,BEYU سایه چشم تک-373
6260664105501,YVES ROCHER شامپو بدن وانیل
6260664105495,YVES ROCHER شامپو بدن زیتون
6260664105471,YVES ROCHER شامپو بدن تمشک
8009518113600,DEBORAH NAIL CARE LINE 87
3365440376007,YSL M.U MASCARA SINGULIER-24
3439602100318,THIERRY MUGLER A TRAVELES LE MOIROIR EDP 50ML
8015150130325,COLLISTAR EXTRA LIGHT COMPACT POWDER-032
3439602100110,THIERRY MUGLER MIROIR DES VANITES EDP 50ML
4019674011508,ARTDECO لاک ناخن سرامیکی 50
4033651312600,BEYU لاک ناخن-260
3562700403163,JAGUAR WOMAN PURPLE EDT 75ML
3760048930987,کلو وکلايو و ميس کورول عطريات کلو لوليز ست عطر پسرانه
4019674486160,ARTDECO کرم پودر هیدرا 16
4019674208083,ARTDECO ریمل همه کاره 8
3052503891316,BOURJOIS سایه چشم کشیده-13
3760048930710,کلو وکلايو و ميس کورول عطريات کلو کلاسيک ست عطر کلو بلو
3348900774056,DIOR FOREVER  W EDT 50ML
6260664103453,YVES ROCHER کرم مرطوب روز و شب تیوپی
2629940024204,DMGM سایه چشم سه رنگ 26
3760048931533,کلو وکلايو و ميس کورول عطريات کلو کلاسيک ست ادو سنتور لي لي بلو 50ml با قاب عکس
4005808381418,کرم دی ان ایچ ترمیم کننده
3052505280118,BOURJOIS آب پاکسازی آرایش
6260664103774,YVES ROCHER اينوزيتول وژتال كرم باز سازي كننده شب
6260664103781,YVES ROCHER اينوزيتول وژتال كرم ضد چروك روز كاسه اي
2629940015219,DMGM سایه چشم تک رنگ کلاسیک 01
3365440299726,YSL M.U ROUGE VIBRATION-218
8004608105787,COMFORTZONE AROMASOUL ORIENTAL CANDLE 130GR-64
8426017031875,LOEWE LOCO LOEWE EDP 30 ML
2629940023849,DMGM لاک ناخن صدفی 01
11111,THIERRY MUGLER WOMANITTY 10ML
8004608104469,COMFORTZONE AROMASOUL INDIANL SHOWER GEL-196
8009518111590,DEBORAH SHINE TECH NAIL ENAMEL 02
4019674333792,ARTDECO رژ لب مینرال 79
3052505150312,UNE يون مداد ابرو  3
3419020230408,MASAKI MATSUSHIMA AQUA MAT M EDT 40 ML
3600521113172,L'OREAL پاک کننده الکسیر 100 میل
4033651032935,BEYU رژ لب کت واک- 93
8004608163428,COMFORTZONE b0524
3052505260516,UNE يون برس رژگونه ( تاثير ترکيبي )
3439600235098,THEIRYY MUGLER ANGEL VIOLET  W 25ML
3365440333598,YSL M.U GLOSS REPULPANT-021
3365440258648,YSL M.U DOU EXPERT SOURCILS-962
4019674347225,ARTDECO رژ گونه مینرال 22
8004608105824,COMFORTZONE AROMASOUL ORIENTAL SPRAY 130GR-68
737052351018,BOSS HUGO BOSS EDT 50ML
8004608105770,COMFORTZONE AROMASOUL INDIAN CANDLE 130GR-63
8004608105794,COMFORTZONE AROMASOUL ARABIAN CANDLE 130GR-65
4019674048634,ARTDECO کرم پودر هیدرا 63
4019674345634,ARTDECO سایه چشم پخته مینرال634
8015150130318,COLLISTAR EXTRA LIGHT COMPACT POWDER-031
8009518115796,DEBORAH MAT EYE SHADOW 06
8004608155553,COMFORTZONE HYDRATING KIT 4 PROD-112
7640111523604,JAGUAR VISION  EDT 60ML
3052505221302,UNE يون سايه چشم اسفوماتو  13
3365440306042,YSL M.U EVERLONG MASCARA-223
4033651352705,BEYU سایه چشم تک-270
2629940017268,DMGM مداد چشم و لب کلاسیک 19
8015150200349,COLLISTAR COMPACT MATTE-FINISH FOUNDATION-034
8015150131230,COLLISTAR SILK EFFECT LOOSE POWDER-123
8009518115741,DEBORAH MAT EYE SHADOW 01
737052055978,BOSS WOMAN EDP 50 ML
737052098715,BOSS IN MOTION ELECTRIC EDT 40ML*
4033651342485,BEYU مداد چشم کت واک-48
8015150154765,COLLISTAR DUO EYESHADOW EYE LINER-476
2629940020435,DMGM پودر فیکسی مات 03
2629940023887,DMGM لاک ناخن صدفی 05
8010573370624,NOUBA LIP STICK 062
737052028439,LACOSTE INSPIRATION EDP 50ML
3365440103894,YSL M.U FARD A LEVRES ROUGE PUR-659
3052505220107,UNE يون سايه چشم اسفوماتو  1
3052505360209,UNE پالت سایه چشم 3تایی2
2629940025881,DMGM لاک درخشان 37
8009518121568,DEBORAH MONO HI TECK EYE SHODOW 64
4005808181759,نیوا کرم ترمیم کننده و بازسازی کننده شب
2629940017237,DMGM مداد چشم و لب کلاسیک 16
3423470481129,ISSEY MIYAKE DEO ROLL
5000167027938,A.P AGENT PROVOCATEUR EDP 50ML^*
2629940022927,DMGM رژ گونه پودری براق 02
3282779028981,KLORANE بالزام شیرجو
3282779010085,GALENIC سفت کننده سینه الانسیل
2629940025829,DMGM لاک درخشان 31
4019674013564,ARTDECO رژ لب پرفکت 56
4019674194553,ARTDECO برق لب گلامور گلاس 55
3600521082546,L'OREAL کرم دکانترکت دور چشم 15 میل
3052503824307,BOURJOIS مداد چشم ضد اب کلوپ-43
3423470311532,ISSEY MIYAKE SHOWER GEL 200 ML
3052503435305,BOURJOIS رژ لب سوئیت کیس-53
8007033783940,BYBLOS ESSENCE W EDP 100 ML
4019674112946,ARTDECO لاک ناخن سرامیکی 294
8009518115765,DEBORAH MAT EYE SHADOW 03
737052006574,JEAN PATOU PARIS SIRA DES INDES EDP 75ML^*
737052006598,JEAN PATOU PARIS SIRA DES INDES EDP 50ML^*
3052505020301,UNE يون رژ لب 3
3052505000815,UNE مداد تراش یون
42194521,نیوا کرم ترمیم کننده و بازسازی کننده سلولی دور چشم
4033651338426,BEYU رژ لب میوه ای براق-42
3052505231615,UNE سايه چشم اكليلي 16
783320971549,BVLGARI MEN SILVER LIMITED EDITION 100ML
4019674013274,ARTDECO رژ لب پرفکت 27
4019674172568,ARTDECO خط لب نرم ضد اب 56
3274871352989,GIVENCHY SET VERY IRRESISTIBLE 50ML
737052449456,BALDESSARINI DELMAR EDT 50 ML
4033651387189,BEYU کبودی دور چشم مایع جدید-18
3052505162100,UNE يون مداد چشم اسفوماتو  21
6260664102159,YVES ROCHER فيتوم سبو رگولتور شامپو موهاي چرب با تاثير طولاني
3607342237735,DAVIDOF CHAMPION ENERGY 90ML
3365440288348,YSL M.U ROUGE PUR SHINE-903
3365440288508,YSL M.U ROUGE PURE SHINE-911
4003349080418,POCKET NAIL FILE
2629940020428,DMGM پودر فیکسی مات 02
3605471800103,MAX MARA SILK TOUCH EDT 90ML
3052505020202,UNE رژ لب 2
3380290053304,BALMAN EAU D AMAZONE EDT 100ML^*
3365440042896,YSL SAHARIENNE  M EDT 125 ML
3052505150619,UNE يون مداد ابرو  6
6260664103347,YVES ROCHER اكتيو سنستيو كرم ضد چروك چشم هاي حساس
3365440377479,YSL M.U MATT TOUCH -12
4019674111352,ARTDECO لاک ناخن سرامیکی 35
9609925,ORLY in a snap 44320b
2611004,شوت کرم پودر
2611001,شوت پودری
8015150151429,COLLISTAR SILK EFFECT EYE SHADOW -142-22
3600520752471,L'OREAL شامپو 250 میل نوتری گلاس
4019674330289,ARTDECO رژ گونه آرت دکو 28
3282779040884,AVEN مرطوب کننده ملایم اون 884
6260664105464,YVES ROCHER شامپو بدن توت فرنگی
3530019001387,PHYTOMER ست مرطوب کننده بدنSCV492
8004608107767,COMFORTZONE HYDRAMEMORY CREAM 24H2008
6260664105426,YVES ROCHER فيتوم اروما ريلكس شامپو اروماتيك نعناع
4019674030745,ARTDECO سایه چشم 74
3419020230804,MASAKI MATSUSHIMA AQUA MAT M EDT 80 ML
3052505360100,UNE پالت سایه چشم 3تایی1
2629940017183,DMGM مداد چشم و لب کلاسیک 11
4033651350398,BEYU سایه سه تایی کت واک-39
3439600238099,THEIRYY MUGLER ANGEL ROSE W  25ML
4033651350312,BEYU سایه سه تایی کت واک-31
3052505060604,UNE يون رژ گونه  6
6260664105488,YVES ROCHER ژل دوش توت وحشی
3600520815626,L'OREAL ریمل دابل اکستیشن مشکی
6260664103668,YVES ROCHER ريچ كرم ضد چروك شب
3282779207881,DUCRAY کرم اگزومگا
3439600236095,THEIRYY MUGLER ANGEL PIVOINE W 25ML
8011003033089,EURO ITALIA REPORTE EDT 75ML
3386461018295,S.T. DUPONT ORAZULI POUR FEMME EDP 30 ML
8009518117448,DEBORAH MONO HI TECK EYE SHODOW 59
4033651313911,BEYU لاک ناخن جدید 391
3346131900015,HERMES UNJARDIN SOUS LA MOUSSON W EDT 50ML
3052503821306,BOURJOIS ریمل حجم دهنده والیوم گلامور اولترا کر 11
3439600237092,THEIRYY MUGLER ANGEL LYS W 25ML
8015150154727,COLLISTAR DUO EYESHADOW EYE LINER-472
4019674000003,ARTDECO کیف کوچک مینرال9810
8015150121743,COLLISTAR COLOR LIPSTICK ROUGE VIBRAZION-174-14
4019674040225,ARTDECO یدک پن کیک ابریشمی 22
3052505230311,UNE سايه چشم اكليلي 3
3052503800202,BOURJOIS ریمل ولومایزر 2 (قهوه ای)
8015150151528,COLLISTAR SILK EFFECT EYE SHADOW -152-32
3605520380259,EMPERIO ARMANI DIAMOND ELLE W EDP 50ML
88300196807,CALVIN KLEIN IN2U HER EDT 100 ML
9610426,ORLY rdgfiller - box   44120[
3530013501944,PHYTOMER ماسک ضد لک وروشن کننده وایت اکلت SVV099
2629940020794,DIANA لاک سحر امیز 59
4019674346488,ARTDECO سایه مینرال 48
8009518211542,BE SPRAY DRY OIL SPF6
3052505320302,UNE يون کرم پودر 100% معدني  3
3052505021209,UNE يون رژ لب 12
4019674330036,ARTDECO رژ گونه 03
4033651350671,BEYU سایه سه تایی کت واک-67
3052505291015,UNE كرم شب مغذي پوست
3274871371232,GIVENCHY SET ANGE ETRANGE 50ML
3600520752075,L'OREAL نرم کننده 250 میلی نوتری گلاس
3054080004530,L'OREAL رنگ مو بزرگ 4/16
3432240005564,CARTIER MUST HOMME DE CARTIER EDT 50ML M
3052505190127,UNE يون ريمل چند کاره  1
4019674111826,ARTDECO لاک ناخن سرامیکی 82
3052505150411,UNE يون مداد ابرو  4
