Barcode,ItemName
3365440024762,YSL M.U FARD A LEVRES ROUGE PUR-622
3454960026759,Lalique Set Nilang W EDP 100ml
3365440071254,YSL M.U TEINT SINGULIER-232
4033651313263,BEYU لاك ناخن جديد 326
4033651313362,BEYU لاك ناخن جديد 336
9674424,ORLY BUBBLY BOMBSHELL
9606520,ORLY PASSION FRUIT
3365440195011,YSL SET MASCARA SHOCKING-123
3365440331129,YSL M.U SKIN CARE WHITENNING EMULSION 50ML-431
3365440074187,YSL M.U EYE LINER EFFECT FAUX CILS-006
3365440074040,YSL M.U EYE LINER EFFECT FAUX CILS-004
3365440096660,YSL M.U MASCARA VIO EFFECT-621
3365440225305,YSL MASCARA VOLUME EFFECT WP-745-1
8015150263030,COLLISTAR TANNING COMPACT POWDER-303
3365440377219,YSL M.U DOU LIP COLOR PALLETE-490
3365440061231,YSL M.U OMBRE DOU LUMIERES 156-41
80116088,PUPA کیت شماره 50302
80116090,PUPA کیت شماره 702
3365440334847,YSL M.U TEINT MAJEUR-593
80116076,PUPA کیت شماره 40101
9676927,ORLY GILDED CORAL
4033651939579,BEYU كيت سايه چشم چهارتايي جديد 57
4033651338396,BEYU رژ لب میوه ای 39
4033651313317,BEYU لاک ناخن جدید 331
4033651310972,BEYU لاک 97
9677023,ORLY FANCY FUCHSIA 40745
4033651036711,BEYU خط چشم ماژیکی XXL
4033651384157,BEYU کرم پودر بمبی-15
3365440213807,YSL SET GLAMOUR LOOK-794
4033651384324,BEYU کرم پودر تیوپی جدید 32
9655322,ORLY MA CHERIE
9607325,ORLY sweet blush   424760
9672824,ORLY PIXY STIX
8011607099498,PUPA MULTIPLAY - Eye pencil with shading sponge #27
4033651351050,BEYU سایه چشم تک-105
3365440376403,YSL M.U GLOSS PURE-55
3471343022337,INGRIDMILET سورس پیور / دمکوئیلانت دلیکیت 200 میل
3365440352681,YSL M.U TOUCH BLUSH-066
3365440288928,YSL M.U NAILS LA LAQUE-081
4033651349026,BEYU سایه چشم دو تایی-2
4033651327208,BEYU رژ لب care&shine -20
4033651311542,BEYU لاک ناخن-154
4033651389053,BEYU سایه پودری MINERAL -05
4033651349293,BEYU سایه چشم دو تایی-29
4033651311092,BEYU لاک ناخن-109
4033651312808,BEYU لاک جدید 280
3365440009714,YSL M.U TEINT DE SOIE-655
3365440195875,YSL TOUCH ECLAT COLLECTOR 02
4033651381873,BEYU پنکیک برنزه 7  MAGNUM
4033651939920,BEYU كيت سايه چشم چهارتايي جديد 92
9606326,ORLY SYNCHRO
80116091,PUPA کیت شماره 703
3365440194878,YSL SET MASCARA VOLUME EFFECT FOUX CILS-121
4033651310859,BEYU لاک جدید 85
8011003805549,JOHN RICHMOND VIVA ROCK W EDT 30ML
3365440333154,YSL M.U LIP TWINS-243
3352810276234,KENZO EAU DE FLEUR SILK EDT W 50 ML
3607340427626,SEDUCTIVE M EDT 50 ML
3365440306868,YSL M.U FROZEN EYE SHADOW-262
9604328,ORLY ruby 40363
3365440351912,YSL M.U GOLDEN GLOSS-732(12)
3365440259782,YSL M.U NAILS LA LAQUE-814
3365440353022,YSL M.U FARD A LEVRES ROUGE PUR-141
8011530360016,FERRE EDP  W 30ML
4033651381859,BEYU پنکیک برنزه 5 MAGNUM
9660926,ORLY GOIN TO THE CHAPEL
3365440313637,YSL S HYDRATING GEL JAR 50ML-374
80116078,PUPA کیت شماره 40201
9603523,ORLY ROCK-ON RED
3365440098404,YSL M.U FARD A LEVRES ROUGE PUR-661
8015150250337,COLLISTAR S TALASSO SCRUB-033
4033651384355,BEYU کرم پودر بمبی-35
3365440209664,YSL M.U OMBRE SOLO-709
9657223,ORLY TWO-HOUR LUNCH
4033651326591,BEYU رژ لب STAR -59
3365440353527,YSL M.U ROUGE VOLUPTE-018
8011607162956,PUPA SMOKY EYES BLACK KIT 4EYES+MULTIPLAY 09
3365440557741,YSL M.U ROUGE VOLUPTE-304
4033651313355,BEYU لاك ناخن جديد 335
3471343022351,INGRIDMILET سورس پیور / دمکوئیلانت اکسیژن 200 میل
8011607168996,PUPA GOLDEN CASINO-PUPA COMPACT EYESHADOW01
8034097953057,UNGARO BLUE ICE M EDT 50 ML
4033651326553,BEYU رژ لب استار 55
4033651338662,BEYU رژ لب میوه ای براق-66
3365440595552,YSL M.U ROUGE PUR COUTURE-202
3365440624894,YSL M.U GOLDEN GLOSS-757(37)
9605628,ORLY MINDS EYE
9690121,ORLY FAINT OF HEART
3365440110236,YSL M.U ROUGE VIBRATION-206
3365440305960,YSL M.U BAUME DETE-795
3760048937030,GOLD 24 EDT 50ML
4033651311993,BEYU لاک ناخن-199
8011607173242,PUPA JEANSES ROSES LUMINYS SILK01
3346470114692,GUERLAIN LA PETIT ROBE NOIRE EDP 30ML
3365440334861,YSL M.U TEINT MAJEUR-594
4033651349286,BEYU سایه چشم دو تایی 28
3365440353442,YSL M.U ROUGE VOLUPTE-014
4033651349323,BEYU سایه چشم دو تایی-32
3471343022368,INGRIDMILET سورس پیور / لوسیون اکسیژن 200 میل
9605521,ORLY soul mate   404210
3390151082701,PAYOT HYDRATING CLEANSING LOTION
8034097953040,UNGARO BLUE ICE M EDT 30 ML
3365440559387,YSL M.U GLOSS  VOLUPTE-797
9661721,ORLY PERFECTLY PLUM
3471343034026,INGRIDMILET سورس پیور / مگنولیس کرم 50 میل
9677227,ORLY SAPPHIRE SILK
4033651936592,BEYU کیت سایه 4تائی جدید 59
4033651310910,BEYU لاک ناخن-91
9672921,ORLY LOLLI POP
9664825,ORLY quite conter ary berry   406480
3454960026773,Lalique Set Le Parfum W EDP 100ml
9600225,ORLY NAUGHTY
3365440243163,YSL MASCARA EFFECT FX CILS SHOCKING 20
4033651310934,BEYU لاک ناخن-93
9672426,ORLY PURE PETUNIA
3365440377530,YSL M.U MATT TOUCH COMPACT FOUNDATION-14
3365440565708,YSL M.U TEINT RADIANCE - 676
9602223,ORLY BUS STOP CRIM SON
3365440073838,YSL M.U EYE LINER EFFECT FAUX CILS-001
9692925,ORLY RAPTURE
4033651384287,BEYU کرم پودر بمبی-28
3365440376427,YSL M.U GLOSS PURE-56
4033651311962,BEYU لاک ناخن جدید 196
4033651338389,BEYU رژ لب میوه ای براق-38
3365440624818,YSL M.U GOLDEN GLOSS-755-35
27131771906,SENSUOUS NOIR EDP 50ML
400600,ORLY BUFFING TRIO 43571
3577588000069,BOUCHERON MISS BOUCHERON JEW SECRET EDT 100ML
801515003,COLLISTAR PACK MAN NO 3
8011607169115,PUPA GOLDEN CASINO-PUPA STYLO EYESHADOW 02
801515002,COLLISTAR PACK MAN NO 2
9671524,ORLY DOWN RIGHT RED
8426017034913,LOEWE AGUA MEDITERRANEO EDT 100ML
3365440071285,YSL M.U TEINT SINGULIER-235
3365440304956,YSL M.U POUDRE COMPACT ECLAT-542
3365440157378,YSL LE TEINT TOUCH ECLAT BD20
4033651002365,BEYU لاك ناخن جديد 456
679602511018,POLICE MAVIVE DARK EDT 100ML
9672620,ORLY BLUSHING BUD
3352810291077,KENZO-EAU DE FELEUR-PLUM EDT W 50 ML
8011530901165,FERRE BLUE MARINE BELLISSIMA  M 30ML
3365440539273,YSL M.U FARD A LEVRES ROUGE PUR-151
4033651311276,BEYU لاک ناخن 127
4033651384508,BEYU کرم پودر تیوپی جدید  50
4033651349200,BEYU سایه چشم دو تایی-20
376004879200,MAUBOUSSIN TESTER POUR LUI EDP100ML
4033651002372,BEYU لاك ناخن جديد422
4033651346742,BEYU مداد چشم-674
3365440181250,YSL ROUGE PURE COUTURE-107-41
9691227,ORLY BEACH CRUISER
9668229,ORLY hot shot   406820
9671728,ORLY TEMPTRESS
4033651338624,BEYU رژ لب میوه ای 62
4033651338181,BEYU رژ لب میوه ای 18
3365440096240,YSL S ANTI CERNES-963
4033651310828,BEYU لاک ناخن جدید 82
9632224,ORLY VA VA  VOOM 40090
3365440194809,YSL SET TOUCH ECLAT+MASCARA SHOKING-120
3365440377561,YSL M.U MATT TOUCH COMPACT FOUNDATION-15
3365440348684,YSL M.U FARD A LEVRES ROUGE PUR SHINE-626
3365440073906,YSL M.U EYE LINER EFFECT FAUX CILS-002
3471343022405,INGRIDMILET سورس پیور / لاکتالیس 200 میل
3365440215962,YSL NAILS COUTURE LA LAQUE-333-32
4033651338716,BEYU رژ لب میوه ای 71
8435137701759,PRADA Amber EDP 80ml Women
8009518121872,DEBORAH NAIL SPACE BRILLIANT TOP COAT
3365440209572,YSL M.U OMBRE SOLO-706
8431003641143,VW TROPIC W 50ML
9666027,ORLY LOLA
3471343035368,INGRIDMILET خاویار/ اسموتینگ فوندیشن 030
3365440565661,YSL M.U TEINT RADIANCE - 675
3365440565821,YSL M.U TEINT RADIANCE-679
4033651313249,BEYU لاک ناخن جدید 324
9603727,ORLY SHOCKWAVE
3346475500087,Guerlain Tester Homme EDP 80ml
3390153874113,PAYOT PV DES LIFT LEVERS
8431003001244,VW PLATINUM W 75ML
3274870072567,GIVENCHY GENTELMAN M 100 ML
8015150290760,COLLISTAR S ANTI-HAIR LOSS REVITALIZING VIALS-076
4033651338204,BEYU رژ لب میوه ای براق-20
8015150137935,COLLISTAR BRONZING POWDER-793 
3346470114074,GUERLAIN IDYLLE W EDP 11ML
3365440209756,YSL M.U OMBRE SOLO-712
3365440259751,YSL M.U NAILS LA LAQUE-813
3471343022627,INGRIDMILET سورس پیور / لوسیون آروماپیور 200 میل
3365440209633,YSL M.U OMBRE SOLO-708
3365440209725,YSL M.U OMBRE SOLO-711
3365440195158,YSL SET MASCARA VOLUME EFFECT+TOUCH ECLAT-125
8015150113014,COLLISTAR GLOSS DESIGNE-301
96200009301,ORLY UNLAWFUN
4033651338440,BEYU رژ لب میوه ای براق-44
3471343009581,INGRIDMILET سورس پیور/لوسیون دلیکیت400 میل
3365440353480,YSL M.U ROUGE VOLUPTE-016
3365440125018,YSL SKIN CARE TEMP MAJOUR EYES SUPREME 988
3365440334649,YSL M.U NAILS LA LAQUE-833
4033651384454,BEYU کرم پودر تیوپی جدید  45
3390156705308,PAYOT PV DEODORANT 24 HOURS
767418286029,L.SOPRANI  D SOIR W EDP 100ML
8431754420004,SET AMBAR 100ML
3454960026711,Lalique  Set Amethyst W EDP 100ml
3471343035641,INGRIDMILET سوبلیم/سوبلیم سافت 200 میل
3471343037249,INGRIDMILLET کیت فرش سیلز 4* 30 
3365440243422,YSL MASCARA EFFECT FX CILS SHOCKING-07
3365440333291,YSL M.U LIP TWINS-410
3365440333338,YSL M.U LIP TWINS-412
4033651939531,BEYU كيت سايه چشم چهارتايي جديد 53
3365440377103,YSL M.U ROUGE PUR SHINE-933
3365440353404,YSL M.U ROUGE VOLUPTE-012
3365440209152,YSL M.U TEINT ECLAT DE SOIE-387
3365440397538,YSL M.U TEINT PURFAIT-369
4033651386281,BEYU کرم پودر بمبی-8
3365440384583,YSL M.U TOUCH BLUSH-071-11
3365440145122,YSL VOILE DE BLISH-53-1
27131595045,SENSUOUS EDP 50ML
3365440073975,YSL M.U EYE LINER EFFECT FAUX CILS-003
3365440071247,YSL M.U TEINT SINGULIER-231
3365440122567,YSL NAILS LALAQUE-942-128
3365440351974,YSL M.U ROUGE PUR SHINE-929
3432240026798,CARTIER-BAISER VOLE SHOWER GEL 200ML
3365440351950,YSL M.U ROUGE PUR SHINE-928
3365440209459,YSL M.U OMBRE SOLO-702
3365440122420,YSL NAILS LALAQUE-939-126
3419020686007,JAC FATH MONSIEUR RDT 100ML
96200007857,ORLY FLASH GLAM_TOO FAB
8015150114431,COLLISTAR SUPERGLOSS-443-13
9670525,ORLY PRINCE CHARMING
3274871359742,GIVENCHY C1157VERY WINTER EDITION 50ML
96200007215,ORLY STAR SPANGELED
3365440351776,YSL M.U EYE COLOR TOUCH-473
3471343030141,INGRIDMILET خاویار/اکسترکت بایومارین 4ویالی
8015150250436,COLLISTAR S MAXI FLUID
3365440377684,YSL M.U MATT TOUCH-19
3365440334946,YSL M.U TEINT MAJEUR-598
4033651338266,BEYU رژ لب میوه ای 26
4033651338327,BEYU رژ لب میوه ای براق-32
3365440375796,YSL M.U ROUGE VOLUPTE-022
96200407947,ORLY BEAUTIFUL DISASTER
96200208056,ORLY MACABRE MASQUERADE
8015150135504,COLLISTAR SUPERMOISTURIZING FOUNDATION-550
96200007864,ORLY FLASH GLAM_WATCH IT GLITTER
96200007918,ORLY GLAM_ROCKETS RED GLARE FLASH
8032529112355,UNGARO APPARITION EDP 100ML
3419020681002,JAC FATH FEMME EDP 100ML
3365440225442,YSL MASCARA VOLUME EFFECT WP-747-3
3390152001305,PAYOT FACE HYDRATING CREAM
3390150526923,PAYOT AOXSOIN GLOBAL CONT YEUX
3365440144910,YSL MASCARA SINGULIER-27
3365440376564,YSL M.U FARD A LEVRES ROUGE PUR-143
3471343035474,INGRIDMILET خاویار/ براتینگ ماسک 75 میل
3365440246218,YSL M.U TEINT MAT PURETE-444
94922191649,T.R HIPPIE CHIC W EDP 100 ML
3471343035412,INGRIDMILET خاویار/ فلوئید فوندیشن 140
3365440074118,YSL M.U EYE LINER EFFECT FAUX CILS-005
4033651005137,BEYU رژلب استار 14
8009518176087,DEBORAH EYE LINER 08
3365440217157,YSL PALETTE COUTURE 372
4033651311399,BEYU لاک ناخن 139
3365440333901,YSL M.U GOLDEN GLOSS-729
3365440229396,YSL NAILS COUTURE LA LAQUE-485-33
9693526,ORLY TORRID
4033651035622,BEYU سایه چشم چهار تایی کت واک-62
9692828,ORLY SMOLDER
3365440117037,YSL ROUGE COUTURE VERNIS A LEVRES-847-1
3365440619944,YSL M.U OMBRE SOLO-861
9692721,ORLY IGNITE
4033651349378,BEYU سایه چشم دو تایی-37
8011607160976,PUPA LUMINYS TOUCH-FACE ILLUMINATOR WITHLIGHT-EFFECT TREATMENT #1
9664320,ORLY one nightstand
4033651349767,BEYU سایه چشم دو تایی 76
4033651349149,BEYU سایه چشم دو تایی-14
9629327,ORLY RAGE
9648128,ORLY POLISHIED 44270
4033651313386,BEYU لاک ناخن جدید 338
4033651005199,BEYU مداد دوکاره چشم 320
4033651349170,BEYU سایه چشم دو تایی-17
4033651002389,BEYU لاك ناخن جديد 341
4033651313300,BEYU لاك ناخن جديد 330
8009518028508,DEBORAH SHINE TECH NAIL ENAMEL 58
9690325,ORLY YOURE BLUSHING
96200208049,ORLY DIGITAL GLITTER
3365440157309,YSL LE TEINT TOUCH ECLAT BD10
4033651311030,BEYU لاک ناخن-103
4033651310958,BEYU لاک ناخن-95
4033651311412,BEYU لاک جدید 141
856013002025,JENIFER ANISTON EDP 85 ML
8051080001014,ROMEO GIGLI EDP 100 ML
8015150260657,COLLISTAR ACTIVE PROTECTION SUN FACE CREAM SPF50 50ML 065
3471343035375,INGRIDMILET خاویار/ اسموتینگ فوندیشن 040
8034097955136,UNGARO FOR HER EDT 30 ml
4033651349675,BEYU سایه چشم دو تایی-67
4033651349644,BEYU سایه چشم دو تایی-64
4033651349682,BEYU سایه چشم دو تایی-68
8034097952197,UNGARO HOMME III LIMITED EDITION M EDT 100 ML
96200009301,ORLY Nail Lacquer Unlawful
4033651349606,BEYU سایه چشم دو تایی-60
4033651325082,BEYU رژلب CATWALK GLAMOUR 8
9667026,ORLY CUPCAKE
4033651310842,BEYU لاک ناخن جدید 84
8011530903596,FERRE BLUE MARINE BELLISSIMA  M 50ML
3365440208957,YSL M.U TEINT PARFAIT-365
3365440157026,YSL LE TEINT TOUCH ECLAT BR10
8011607164400,PUPA Glitter Eyeliner Pencil - Eyeliner #302
3365440209176,YSL M.U TEINT ECLAT DE SOIE-389
4033651939760,BEYU كيت سايه چشم چهارتايي جديد 76
3365440305663,YSL M.U GOLDEN GLOSS-721
9667123,ORLY PETIT FOUR
8015150251440,COLLISTAR BIO REVITALIZING ANTICELLULITE CONCENTRATE 200ML 144
3365440353084,YSL M.U GOLDEN GLOSS-734(14
8009518028430,DEBORAH SHINE TECH NAIL ENAMEL 55
3454960026728,Lalique Set Fleur De Cristal W EDP 100ml
9600021,ORLY haute red   400010
4033651349514,BEYU سایه چشم دو تایی-51
4033651349354,BEYU سایه چشم دو تایی-35
4033651325020,BEYU رژلب CATWALK GLAMOUR 2
4033651311801,BEYU لاک ناخن جدید 180
4033651337450,BEYU رژ لب مايع CRYSTAL 45
8034097953088,UNGARO BLUE ICE M EDT 100 ML
3471343011713,INGRIDMILET خاویار/ آی ماسک ریلکسانت 15 میل
8034097953026,UNGARO LOVE KISS W EDP 100 ML
3365440334809,YSL M.U TEINT MAJEUR-591
3365440194731,YSL SET TOUCH ECLAT-119
3365440117105,YSL ROUGE COUTURE VERNIS A LEVRES-848-2
8011607160983,PUPA LUMINYS TOUCH-FACE ILLUMINATOR WITHLIGHT-EFFECT TREATMENT #2
3365440348622,YSL M.U ROUGE PUR SHINE-924
9671922,ORLY hot chocolate   407190
4033651349422,BEYU سایه چشم دو تایی-42
4033651345585,BEYU مداد خط لب-558
3365440287976,YSL M.U TEINT COMPACT HYDRA FEEL-461
8426017031899,LOEWE LOCO LOEWE EDP 100 ML
96200207929,ORLY SPARKING GARBAGE
3365440624931,YSL M.U GOLDEN GLOSS-758(38)
8015150158817,COLLISTAR Duo eye penil 881
9601020,ORLY MONROES RED
9600827,ORLY EVER BURGUNDY
3365440219045,YSL DARE TO GLOW 01
8011607165520,PUPA Lasting Color 5ml #510
3365440334823,YSL M.U TEINT MAJEUR-592
9610620,ORLY second dry - box   44310[
9608528,ORLY pink nude   420090
3365440376885,YSL M.U FARD LUMIERE AQUARESISTANT-01
3365440289246,YSL M.U MASCARA INFINI CURL-604
3365440208834,YSL M.U TEINT PARFAIT-361
9692420,ORLY GLOW
3365440376861,YSL M.U NAIL TOUCH-036
8011530500030,ROBERTO CAVALLI W 75ML
9692527,ORLY FLARE
8011530500023,ROBERTO CAVALLI 40 ML W EDP
8011530500016,ROBERTO CAVALLI 25 ML W
737052145679,BOSS PURE EDT 75ML
8426017029810,LOEWE ILY TONIGHT EDT 50 ML
8034097955150,UNGARO FOR HER EDT 100 ml
3365440376847,YSL M.U NAIL TOUCH-035
3274871352446,GIVENCHY VERY HARVEST 60 ML
3471343011676,INGRIDMILET خاویار/ ماسک ریچ 75 میل
3365440375840,YSL M.U OMBRES 5 LUMIERES-848
3365440352568,YSL M.U NAIL TOUCH-033
3365440232501,YSL MASCARA VOLUME EFFECT WP-141-5
3274871211378,GIVENCHY ORGANZA HARVEST 60 ML
4033651005205,BEYU مداد دوکاره چشم 383
3365440376540,YSL M.U BLUSH VARATION-018
3365440351899,YSL M.U FARD A LEVRES ROUGE PUR-139
3274871122537,GIVENCHY AMARIGE HARVEST 60 ML
3577588020005,BOUCHERON MISS BOUCHRON EDP 10ML
3471343010990,INGRIDMILET سورس پیور/لاکتالیس400 میل
3471343034019,INGRIDMILET سورس پیور / آرومافلور کرم 50 میل
3471343031162,INGRIDMILET بایوالیتا / فرش سیلز 125 میل
85715135322,BEBE LOVE RED EDP 100ML
3365440747401,YSL TESTER L'HOMME LA NUIT ARTY EDT 100ML
8015150159586,COLLISTAR MASCARA INFINITO 958
8015150157650,COLLISTAR PROFESSIONAL EYE PENCIL -765-15
3365440229532,YSL BOREAL PALETTE ARCTC NIGHT-054
9691324,ORLY SKINNY DIP
3439602807538,THIERRY MUGLER TESTER ALIEN EAU EXTRAORDINAIRE EDT 90ML
4033651311429,BEYU لاک ناخن جدید 142
8034097955112,UNGARO POUR LHOMME III PARFUM AROMATIQUE MAN EDT 100 ML
16552000894,DELON بادی باتر براق کننده و تثبیت کننده
8011607164424,PUPA Glitter Eyeliner Pencil - Eyeliner #500
3365440747227,YSL TESTER L'HOMME LIBRE ARTY EDT 100ML
767418286012,L.SOPRANI  D SOIR W EDP 50ML
3274871371492,GIVENCHY ANGE OU LE SECRET WINTER 50ML
8034097955143,UNGARO FOR HER EDT 50 ml
3352817607253,KENZO POUR HOMME EDT 50ML
3360373016341,CACHAREL NOA W EDT 50ML
8009518104721,DEBORAH MONO-HIGH TECH EYE SHADOW 28
3365440563186,YSL M.U OMBRE SOLO-874(14)
8009518104806,DEBORAH MONO-HIGH TECH EYE SHADOW 34
3365440123472,YSL M.U MASCARA EFFECT FX CILS SHOCKING 04
3365440242531,YSL M.U FARD A LEVRES ROUGE PUR-668
3423474871858,ISSEY MIYAKE L'EAU D'ISSEY POUR HOMME EH 2013 LIMITED EDITION EDT 100ML
3274871929389,KENZO AMOUR I LOVE U W EDT 40 ML
3471343035450,INGRIDMILET اویار/برایتینگ کرم 15 میل
8436038835710,TOUS L'EAU 90ML SET
8015150121880,COLLISTAR COLOR LIPSTICK-188-28
7640111498612,LALIQUE TESTER SATINE EDP 100 ML
3471343009574,INGRIDMILET سورس پیور/دمکوئیلانت دلیکیت 400 میل
8051080000512,ROMEO GIGLI EDP 50 ML
4033651035363,BEYU سایه چشم چهار تایی کت واک-36
679602510622,POLICE MAVIVE DARK EDT 50ML
3365440305687,YSL M.U GOLDEN GLOSS-722
8032529116537,SALVATORE FERRAGAMO F FOR FASCINATING W EDT 90ML
3595471041012,MERCEDES BENZ SET CLUB FOR MEN EDT 100ML
4051761005212,ANNY لاک ناخن 304.70
3595471021113,MERCEDES BENZ INTENSE EDT 120LM
8011530995621,TRUSSARDI MY SCENT W EDT 100ML
8411061801055,VALENTINO SET VALENTINA EDP + BODY LOTION 200ML
4033651016911,BEYU رژ لب پیور کالر 69
667526533476,VICTORIA SECRET BODY CREAM ENDLESS LOVE
3365440332607,YSL ELLE SHOWER GEL 200ML
3605532431147,LANCOME O De Loran Gerie W EDT 75ml
3351500920006,AZZARO CHROME M EDT 30ML
783320802768,BVLGARI JASMIN NOIR W SET
88300178117,CK EUPHORIA EDP W 50 ML
3351500956517,AZZARO TWIN MEN EDT 50ML
737052352060,BOSS NIGHT M EDT 100ML
888066001052,TOM FORD FOR MEN 100ML
3351500963010,AZZARO DUO W EDT 30ML
3393670003493,ESCADA SIGNITURE 75 ML
3439609000116,SWAROVSKI ALCOHOL REGULAR REFILL EDP 30ML
3439602810019,THIERRY MUGLER  ALIEN  W EDT 60 ML
767418240007,L.SOPRANI PRETTY GIRL EDT 30ML
3414200801232,JILSANDER - SANDER FOR MEN 125 ML
8007033784954,BYBLOS IN BLACK  M  EDP 100ML
3145891184600,CHANEL ANTAEUS P.H 100M L
737052074740,LACOSTE RED EDT 125ML*
3352818208305,KENZO-JUNGLE POUR HOMME-NEW DESIGN 100ML
3351500956500,AZZARO TWIN M EDT 30 ML
27131043317,ESTTE LAUDER PLEASURE EDP 100ML
8431754341019,HOLLOWEEN W 50ML
3147758155105,LANCOME POEME W EDP 50ML
3432240027214,CARTIER - DE LUNE - 2011 EDT 45ml Women
88300193530,CK INTENSE EUPHORIA M EDT 100ML
3605532431024,LANCOME O De Loran Gerie W EDT 50ml
737052248080,LACOSTE CHALLENGE 75 ML
3137370183914,NINA RICCI RICCI RICCI PREMIER JOUR 100ML
8427395950208,ARMAND BADI IN BLUE 100ML
8002135088382,DUCATI EDT 30ML
8011003061143,MOSCHINO CHIP & CHIC W  EDP 50ML
4013670501995,AIGNER BLACK MAN EDT 125 ML
27131043294,ESTEE LAUDER PLEASURES EDP W 50ML
3414202000534,DAVIDOFF - zino 125 ml
737052139906,HUGO ENERGISE EDT 75ML
20714080310,CLINIQUE HAPPY  EDT M 100ML
4013670504545,AIGNER MAN 2 EDT M 50 ML
3145891236200,CHANEL ALLURE SPORT EDT 50 ML
3145891214802,CHANEL ALLURE HOMME EDT 150ML
8011003801619,VERSACE P.H M  EDT 200ML
888066000062,TOM FORD BLACK ORCHID EDP 50ML
8009518404012,DEBBY COLOR MONO EYE SHADOW 11
3346132101633,HERMES VOYAGE LIMITED EDITION 2011 EDT 100 ML
737052145846,BOSS PURE EDT 50ML
3607341792068,GUESS W  EDP 75 ML
783320802706,BVLGARI OMNIA AMETHYST EDP POUCH
3349668508792,PACO RABANNE BLACK XS FOR HER
3139093021429,LANVIN OXYGENE EDP W 75 ML
8009518409673,DEBBY COLOR WERA LIPSTICK 16
3760048790208,LORIENCE LULU JE TAIME EDT 50 ML
4005808837540,رول انرژی فرش
4005808828869,رول آکوا کول مردانه 50 میل
4005900816108,رول درای مردانه 50 میل
8009518000771,DEBBY COLOR PLAY 95
26169040503,new musk for men
3351500997893,AZZARO P.H ELIXIR M  EDT 30 ML
737052189857,GUCCI BY GUCCI EDT M 90 ML
3352810299752,KENZO POUR HOMME-LTD 2010 M EDT 50ML
3147758100785,LANCOME MIRACLE SO MAGIC W EDP 100ML
3419020500501,poiray sceau de coeurs edp 50ml
888066006743,TOM FORD GREY VETIVER 50ML
8009518105025,DEBORAH MONO-HIGH TECH EYE SHADOW 36
9999999999995,DEO SPRAY NIVEA 100ML
3577580603046,BOUCHERON JAIPUR P.H EDT 50ML^*
8009518403442,DEBBY NAIL ENAMEL 11
3351500956524,AZZARO TWIN MEN EDT 80ML
3605520301544,GIORGIO ARMANI ATTITUDE M EDT 50ML
3352810087885,KENZO L'EAUPAR KENZO POUR HOMME -NEW PACKAGE EDT M 30ML
3282779005661,KLORANE ml 250 شامپو بچه
8009518008623,DEBBY COLOR PLAY 121
8009518411393,DEBBY EYE PENCIL 11
3351500952045,AZZARO BRIGHT M EDT 50 ML
3605532431086,LANCOME O De Loran Gerie W EDT 125ml
9999999999998,DEO STICK REXONA 75GR
3352818717005,KENZO KENZOAMOUR EDP W 50 ML
8015150250658,COLLISTAR S BUST RESTORATIVE CAPSULES-065
3282779026024,DUCRAY شامپو کرم آنافاز 50 ml
3577588020500,BOUCHERON MISS BOUCHRON EDP  50ML
3607348078523,CK EPHORIA MEN SET
8009518009927,DEBBY COLOR PLAY 100
8009518413243,DEBBY SHINE WEAR LIPSTICK 06
768614102106,SHISEIDO ZEN FOR MEN EDT 100 ML
737052989587,BOSS INTENSE EDP 50 ML
8009518121117,DEBORAH LIGHT CREATOR LIPSTICK 03
3348900821880,DIOR ADDICT SHINE W EDT 100ML
3577588021101,BOUCHERON MISS BOUCHRON EDP 100ML
3386463038895,BURBERRY LONDON EDP W 50 ML
8009518403329,DEBBY NAIL ENAMEL 05
9999999999996,A/SH GILLET 100ML
8015150151979,collistar silk effect eye shadow-197-57
3351500800650,PORSCHE DESIGN INTENSE LUXURY COLLECTOR
8009518413212,DEBBY SHINE WEAR LIPSTICK 04
8009518409871,DEBBY LIP ENVY LIP GLOSS 13
888066002509,TOM FORD WHITE PATCHOULI 50ML
3439600600414,THIERRY MUGLER A*MEN HAVANE 100 ML
783320802720,BVLGARI AQUA SET
8009518002829,DEBBY COLOR PLAY 98
8009518404456,DEBBY EYE PENCIL MEGA 6
3352818016023,KENZO-JUNGLE ELEPHANT W  30ML
8009518404005,DEBBY COLOR MONO EYE SHADOW 10
3432240023162,CARTIER ROADSTER EDT M 100ML+5ML
88300000012,CK CONTRADICTION EDT M 100ML
9999999999999,DEO SPRAY SMART 150 ML
688575201895,CHLOE EDP 100 ML
8015150260329,COLLISTAR S SUPERTAN WATER
8009518409727,DEBBY COLOR WERA LIPSTICK 21
85715240507,NINE WEST LOVE FURY EDP 50 ML
3471343035610,INGRIDMILET سوبلیم/سوبلیم سلیم 200 میل
8009518404203,DEBBY NAIL ENAMEL 44
3471343036068,INGRIDMILET اکستراکچر اسنس دور چشم
3282779175012,KLORANE محلول ضد ریزش کینین/آقایان
8411061725979,VALENTINO TESTER VALENTINA W EDP 80 ml
8009518404296,DEBBY EYE PENCIL 02
8009518410624,DEBBY LASTING SOLUTION FOUNDATION 203
3351500800773,Porsche Tester Design The Essence Intense M EDT 80ml
875887001200,S&W EDT 100ML
3348900821934,DIOR MIDNIGHT POISON W  EDP 50ML
8009518410396,DEBBY COLOR DUO EYE SHADOW 07
8009518410402,DEBBY COLOR DUO EYE SHADOW 08
88300162543,CK EPHORIA W EDP 50ML
3386461515688,LANVIN ECLAT W 50ML
8009518000795,DEBBY COLOR PLAY 96
3346131500048,HERMES KELLY CALECH W EDT 50ML
3331434010000,Cafe Black Tester Black Label Pour Homme EDT 100ml
8009518081725,DEBBY EYE PENCIL GLOSSY 05
737052522555,GUCCI FLORA GLAMOROUS MAGNOLIA W 100ML
3386460010004,BURBERRY TESTER LONDON W 100ML
3349666009840,Paco Rabanne Tester Black Xs Pour Elle EDT 80ml
3605521172587,GIORGIO ARMANI AQUA DI GIOA EDP 50 ML
737052074450,DOLCE & GABBANA POUR HOMME EDT M 125 ML
3386460013673,BURBERRY THE BEAT FOR MEN EDT 75 ML
7640111520002,Jaguar Tester Vision II M EDT 100ml
8009518403916,DEBBY COLOR MONO EYE SHADOW 01
8011607169405,PUPA MASCARA EXTRA+MULTIPLAY 09
8015150157575,COLLISTAR PROFESSIONAL EYE PENCIL-575
737052248097,LACOSTE CHALLENGE 90 ML
4019674011133,ARTDECO لاک ناخن سرامیکی 13
8009518408720,DEBBY SPOT SOLUTION THREATMENT
8011607173372,PUPA JEANSES ROSES EYE LINER 04
8011607173341,PUPA JEANSES ROSES EYE LINER 01
8011607173365,PUPA JEANSES ROSES EYE LINER 03
8011607173358,PUPA JEANSES ROSES EYE LINER 02
9999999999997,DEO SPRAY GILLET 150ML
3365440069268,YSL  JAZZ  M  EDT 100ML
4019674173107,ARTDECO خط لب نرم  10
3360372009443,DRAKKAR G.LAROUCH  EDT 50ML
3386463302729,BURBERRY WEEKEND W EDP 100ML
3760048790192,LORIENCE LULU JE TAIME EDT100 ML
3274875162850,Givenchy Tester Xeryus Rouge W EDT 100ml
8011530360000,Ferre Tester  W EDP 100ml
4019674142349,ARTDECO رژ لب با دوام استیک 34
3365440590793,YSL PARISIENNE  EXTREME W  EDP 50 ML
4019674406755,ARTDECO پن کیک ابریشمی 755
4019674011249,ARTDECO لاک ناخن سرامیکی 24
3365440212213,YSL  M7  M EDT 100ML
8431754002187,J.Del Pozo Tester Halloween Sexy W EDT 100ml
4019674030875,ARTDECO سایه چشم 87
4019674030202,ARTDECO سایه چشم 20
4019674011706,ARTDECO لاک ناخن سرامیکی 70
8011003061303,MOSCHINO CHEAP & CHIC W EDT 50 ML
4019674345498,ARTDECO سایه چشم پخته مینرال498
9999999999992,DEO SPRAY 8*4 150ML
4019674013977,ARTDECO رژلب پرفکت97
4019674032794,ARTDECO سایه چشم 279
4019674032824,ARTDECO سایه چشم282
8009518404425,DEBBY EYE PENCIL MEGA 3
4019674195161,ARTDECO رژ لب با دوام 516
4019674030837,ARTDECO سایه چشم 83
85715917157,GAP TESTER ESTABLISHED 1969 M  EDT100ML
3607340205538,CHLOE EDP 50 ML
