Barcode,ItemName
3760016770287,ALEXANDRE.J THE COLLECTOR BLACK MUSCS EDP 100ML
8011607188581,PUPA 50'S DREAM LASTING COLOR APRICOT 516
3365403,YSL PACK NO.3
8011607188550,PUPA 50'S DREAM LASTING COLOR CANDY PINK 215
3365407,YSL PACK NO.7
3147754014338,LANCOME LIP LINER LE CONTOUR 210
3352810291831,KENZO FLOWER BY KENZO ESSENTIELLE EDP W 75 ML
3605530399418,LANCOME MASCARA VIRTUOSE DIVINE LASTING CURVES & LENGTH 01
3575070050035,HORSE BALL EXTREME M EDT 100ml
8011607188475,PUPA 50'S DREAM MISS PUPA PEACH ROSE 205
3605533128015,LANCOME LIPSTICK ROUGE IN LOVE 6H 174 B
3346470109650,GUERLAIN-L'INSTANT EDT W 50ML
8011607196227,PUPA ACTIVE LIGHT-LIGHT ACTIVING PERFECT SKIN FOUNDATION 70
8011003990001,Versace Tester Pour Homme M EDT 100ml
3605533028070,LANCOME MASCARA HYPNOSE DRAMA INSTANT FULL BODY VOLUME 03
8011607188499,PUPA 50'S DREAM MISS PUPA HYBISCUS PINK 306
8018365500000,Versace Tester Eau Fraiche M EDT 100ml
8011607188420,PUPA 50'S DREAM ULTRA SHINE EYELINER 001
3348900821941,DIOR MIDNIGHT POISON W  EDP 100ML
3605530914086,LANCOME LIPSTICK ROUGE LABSOLU SPF 12-252
8011530905019,FERRE IN THE MOOD F.L  W 100ML
8011607190294,PUPA GLOSSY LIPS_ULTRA SHINE LIP GLOOS#101
8011607088393,PUPA NEW CHIC - Luminous Lipstick-140
767418248409,LUCIANO SOPRANI D HOMME SHAMPPO&SHOWER GEL 100ML
3605530914802,LANCOME LIPSTICK ROUGE LABSOLU SPF 12-350
8018365070264,VERSACE CRYSTAL NOIR W  EDP 50ML
3365440569546,YSL BELLE D OPIUM  W EDP 50ML
8011607188574,PUPA 50'S DREAM LASTING COLOR SPICY ORANGE 515
8011003995950,VERSACE P.H M  EDT 50ML
3274870292361,GIVENCHY HOT COUTURE EDT 100ML
8011607129997,PUPA PROFESSIONAL LINER - High Precision and Definition-401
3346470109803,GUERLAIN L'INSTANT-IDG W EDP 50ML
3380811420103,CLARINS LIQUID BRONZE SELF TANING 125 ml
3380814428311,CLARINS ROUGE ECLAT-03
3605532632308,LANCOME RENERGIE ECLAT MULTI LIFT LIFTING -EFFECT & ILLUMINATING SKINCARE 40 ML
3386460035644,BURBERRY  BODY 35ML EDP
8011607188437,PUPA 50'S DREAM ULTRA SHINE EYELINER 002
8011607178377,PUPA MISS PUPA ULTRA BRILLIANT LIPSTICK 304
3605532677095,LANCOME OMBRE HYPNOSE SPARKLING COLOUR HIGH FIDELITY S110
8011607188345,PUPA 50'S DREAM LUMINY SILK OMBETTO COTTO 501
3605532638904,LANCOME LIPSTICK ROUGE IN LOVE 6H 353 M
3274870292354,GIVENCHY HOT COUTURE EDT 50ML
96200208001,ORLY PIXIE POWDER
3346132301149,HERMES JOUR D 'HERMES EDP 85ML
3365440354098,YSL M.U NAILS LA LAQUE-838
3380811877860,CLARINS SET PLANT GOLD SOLUTIONS FOR BODY
3380811878867,CLARINS SET HYDRAQUENCH BEAUTY ROUTINE
3274870412363,"GIVENCHY SET VIG L""INTENSE EDP 75 ML"
3365440259812,YSL M.U NAILS LA LAQUE-815
96200206342,ORLY NEW RED CARPET
79245244104,ORLY CALCIUM SHIELD 18ML
96200206656,ORLY NEW GREEN APPLE
3423470880410,NARCISO RODRIGUEZ FOR HIM MUSC COLLECTION EDP M 100 ML
8009350910016,CESARE PACIOTTI WERUSKA WOMAN  EDP 50ML
96200206618,ORLY NEW BLUE COLLAR
3346470109667,GUERLAIN-L'INSTANT EDT W 80ML
96200202955,ORLY NEW SHINE 20295
8437011481115,CARNER RIMA XI U EDP 100ML
8011607178339,PUPA MISS PUPA ULTRA BRILLIANT LIPSTICK 300
3423470486025,ISSEY MIYAKE INTENSE P.H 75 ML
3365440332522,YSL  ELLE  W EDP 50ML
8011607113095,PUPA EYEBROW PENCIL-702
3274871924469,KENZO FLOWER BY KENZO W EDP 50ML
3346470101678,GUERLAIN-L'INSTANT IDG MAGIC07 EDP W 80ML
3352810257868,KENZO FLOWER BY KENZO TAG EDT W 100ml
3386460012409,VAN CLEEF & ARPELS FEERIE W EDT 100ML
3380811105109,CLARINS MULTI ACTIVE NIGHT NORMAL TO DRY SKIN 50 ML
8411061341704,HERRERA  CH 212 MEN EDT M 50 ML
3348900838178,DIOR HOMME INTENSE M EDT 50ML
8011607174072,PUPA LIP KIT FILLER LABBRA+DIVAS ROUGE 21
3423470883367,NARCISO RODRIGUEZ-ESSENCE-2011 NEW OLFACTIVE  125ML EDT
79245241608,ORLY NEW NAILTRIRION 18ML
96200207615,ORLY NEW SKINNY DIP 20761
8411061778296,CAROLINA HERRERA TESTER 212VIP ROSE W EDP 80 ML
3605470202380,BENNETON JEANS W EDT 100ML
3380814419616,CLARINS ROUGE PRODIGE LIPSTICK-196-116
3380810012644,CLARINS CLEANSING MILK WITH GENTION COMBINATION OR OILY SKIN 400ML
3423473962359,JEAN PAUL GAULTIER KOKORICO BY NIGHT M EDT 50 ML
8011607188604,PUPA 50'S DREAM COLOR TOUCH HIGHLIGHTER 001
3365440666191,YSL LA LAQUE COUTURE VERNIS 22190 14
96200208285,ORLY TINSEL
96200207516,ORLY NEW SWEET PEACOCK
8011607203857,PUPA VAMP COMPACT EYESHADOW 202
8426017039505,LOEWE AURA EDP W 80 ML
3365440123540,YSL M.U MASCARA EFFECT FX CILS SHOCKING 05
3274870250781,GIVENCHY PLAY FOR HER W EDT 50 ML
3274872272897,GIVENCHY GENTLEMEN ONLY INTENSE 100 ML
3145891235807,CHANEL ALLURE HOMME SPORT EXTREME M 150ML
3365440358447,YSL ROUGE PUR COUTURE 820-57
3605533316368,LANCOME SET HYDRA ZEN NEOCALM SOOTHUING ANTI STRESS MOISTURISING CREANM SPF15 50ML+VOS 2 CADEAUX
96200208070,ORLY VOYEURISTIC ADVANTURE
3352819311813,KENZO POWER COLOGNE EDC M 125 ML
96200200746,ORLY NEW MAUVE
3147752770175,LANCOME GLOSS JUICY TUBES ULTRA SHINY HYDRATING LIP GLOSS -017
3274872272880,GIVENCHY GENTLEMEN ONLY INTENSE 50 ML
3380811987835,CLARINS SET SUPER RESTORATIVE LOYALITY VALUE PACK WITH EYE CONCENTRATE
8426017043878,LOEWE AURA W EDT 80 ML
3360372061823,EMPERIO ARMANI IL M EDT 50ML
3386461011203,S.T DUPONT ESSENCE PURE 100ML
3386460028530,MONT BLANC HOMME EXCEPTIONNEL EDT M 75 ML
679602671101,POLICE WINGS GOLD  M 100 ML
3365440375826,YSL M.U OMBRES 5 LUMIERES-847
3386460035637,BURBERRY BODY W EDP 60ML
3365440117945,YSL ROUGE COUTURE VERNIS A LEVRES-860-14
3348900417885,DIOR JADORE W EDP 50ML
715387760026,BENNETON B-UNITED M 100 ML
8411061761526,CAROLINA HERRERA SET 212 VIPW EDP 80ML + BODY LOTION 200ML
3274870374364,GIVENCHY ANGE OU LE  SECRET 100ML
8011003998241,VERSACE  VERSUS W  EDT 100ML
3605533316603,LANCOME SET GLATEIS DOUCEUR+TONIQE DOUCEUR+HYDRA ZEN NEOCALM+BAUME CORPS CONFORT
3365440754737,YSL SET L'HOMME EDT 100ML + AFTER SHAVE 50ML + SHOWER GEL 50ML
3423470482485,ISSEY MIYAKE - l`EAU D`ISSEY FLORAL - 2011 Natural Spray EDT W 90 ML
3274871935878,GIVENCHY GENTELMAN EDT 50 ML
8011003817863,JOHN RICHMOND X MAN EDT 40ML
3386460028493,MONT BLANC FEMME DE EDT 75 ML
3346470115156,GURLAIN IDYL DUET JASMIN LILAS W EDP 50ML
3605533127711,LANCOME LIPSTICK ROUGE IN LOVE 6H 345 B
3348901126342,DIOR HOMME COLOGNE EDT M 75ML
9693429,ORLY MISS CONDUCT
96200204843,ORLY NEW LIQUID VINYL
8011530996284,FERRE BLUMARINE ANNA W EDP 100 ML
3365440358379,YSL ROUGE PUR COUTURE 819-56
783320833649,BVLGARI POUR HOMME EXTREME EDT 100ML
96200225046,ORLY WARM WHITE
783320402593,BVLGARI POUR FEMME EDP 100ML
3274872266643,GIVENCHY VERY IRRESISTIBLE ROSE EDT W 50 ML
3605532869032,LANCOME GLOSS IN LOVE SPARKLING LIPGLAZE COCOONING FEEL-351
3274870553462,GIVENCHY PLAY INTENSE 100ML
8011003802418,MOSCHINO FOREVER  M EDT 100ML
3386460006965,BURBERRY THE BEAT EDP W 75 ML
96200224889,ORLY MAN LAQ JE TAIME 22488
8426017034180,LOEWE QQQ EDT PASION 50 ML
3365440080720,YSL M.U SKIN CARE TEMP MAJUER CREAM-149
679602381062,POLICE CONTEM PORARY EDT 50 ML
3386460032742,TESTER MONT BLANC LEGEND 100ML
3274870250798,GIVENCHY PLAY FOR HER W EDT 75 ML
3380814416516,CLARINS JOLI ROUGE BRILLANT-165-16
3605533320730,LANCOME OMBER HYPNOSE IRIDESCENT COLOR HIGH FIDELITY 1108
3380814419319,CLARINS ROUGE PRODIGE LIPSTICK-193-113
3346470114944,GUERLAIN SHALIMAR LEAU INITIAL SPR 2012 W EDT 100 ML
3439600217094,THIERRY MUGLER ANGEL  W EDP  100 ML
3605533094617,LANCOME EYE LINER ART LINER GENTLE FELT LINER INTENSE -04
3380814421213,CLARINS ROUGE PRODIGE LIPSTICK-212-132
8426017034005,LOEWE SOLO ABSOLUTO EDT 125 ML
9611124,ORLY TOUGH COOKIE 18 ML
96200206243,ORLY NEW TRULY TANGERINE
3380811550107,CLARINS RENEW PLUS BODY SERUM 200ML
3605532612904,LANCOME TESTER LA VIE EST BELLE EDP75ML
3365440051560,YSL SKIN CARE FOREVER LOTION-26623
3605533278352,LANCOME GLASS LIP LOVE DEWY COLORE LIP PERFECTOR 8H MOISTURE-361
3605533320792,LANCOME OMBER HYPNOSE IRIDESCENT COLOR HIGH FIDELITY 1206
3348901157018,DIOR BLUSH- VIBRANT COLOUR POWDER BLUSH- 943
3348900598157,DIOR SKIN FLASH- RADIANCE BOOSTER PEN- 003
3348901076616,DIOR ADDICT EXTREME- LASTING LIPCOLOUR RADIANT SHINE- 756
3348901087247,DIOR ADDICT EXTREME- LASTING LIPCOLOUR RADIANT SHINE- 476
3380814063413,CLARINS MULTI BLUSH CHEEKS LIPS-04
96200208032,ORLY TEAL UNREAL
96200208100,ORLY REQUE ENCOUNTER
96200204898,ORLY NEW NAKED CANVAS BLS
3348901089920,DIOR CONTOR UNIVERSAL TRANSPARENT LIPLINER WITH BRUSH AND SHAPENER
3380810739107,CLARINS INSTANT BRONZE SELF TANING TINT 125ML
3365440568266,YSL M.U GOLDEN GLOSS -739)19
3348901212571,DIOR VERNIS- COURURE COLOUR GEL SHINE AND LONG WEAR NAIL LACQUER-754
3348900997561,DIOR ADDICT LIPSTICK- VIBRANT COLOR SPECTACULAR SHINE- 525
96200208209,ORLY MILKY WAY 20820
4033,PB NYPD CARBOARD VERSION HIM EDT 100ML
3348901134378,DIOR NAIL GLOW INTANT FRENCH MANICURE EFFECT WHITENING NAIL CARE
96200205727,ORLY NEW TWO-HR LNCH 20572
96200208568,ORLY TURN  IT UP IN THE MIX 20856
3432240003638,CARTIER SANTOS DE CARTIER EDT 100ML M
3348901212595,DIOR VERNIS- COURURE COLOUR GEL SHINE AND LONG WEAR NAIL LACQUER-551
96200208582,ORLY INDIE IN THE MIX 20858
96200208551,ORLY POP IN THE MIX ELECRRO 20855
96200207448,ORLY NEW TGLIDED CORAL
3365440396937,YSL M.U GOLDEN GLOSS-7318(18)
3380814427017,CLARINS GLOSS PRODIGE-10
8011003100019,MOSCHINO TOUJOURS GLAMOUR W EDT 30ML
3365440291553,YSL MASCARA VIO EFFECT 062  21
3386460036467,BOUCHERON JAIPUR BRACELET W EDP 100ML
3348901177931,DIOR CRAYON CONTOUR LEVRES- LIP LINER PENCIL- 943
3605533278055,LANCOME GLASS LIP LOVE DEWY COLORE LIP PERFECTOR 8H MOISTURE-363
3380814413119,CLARINS JOLI ROUGE-722-131
3274870552458,GIVENCHY PLAY M 50 ML
3348901212458,DIOR ADDICT FLUID STICK- FABULOUS WEAR HIGH IMPACT GLOSSY COLOUR LIP HYBRID- 754
3380810112207,CLARINS LOTUS FACE TREATMENT OIL
3348900649712,DIOR EYELINER W/P- LONG WEAR W/P EYELINER BLENDING TIP&SHARPENER- 254
3348901120449,DIOR IFIC- LONG WEARING TRUE COLOUR LIPSTICK- 040
3380814413713,CLARINS JOLI ROUGE-728-137
3605532692845,LANCOME TURNS PENCIL KHOL HYPNOSE WATERPROOF -05
3348901207287,DIOR ADDICT FLUIT STICK FABULOUS WEAR HIGH IMPACT GLOSSY COLOUR LIP HYBRID 893
8028713570100,ACQUA DI PARMA BM BERGAMOTTO U EDT 150ML
3575070002034,HORSEBALL IRIS W EDP 100ML
3348900579613,DIOR SKIN FLASH- RADIANCE BOOSTER PEN- 001
783320402524,BVLGARI MON JASMIN NOIR LEAU EXQUISE W EDT 75ML
8028713470011,ACQUA DI PARMA MAGNOLIA U EDP 50ML
3348900286184,DIOR LINER- PRECISION EYELINER- 798
8016741952203,TIZIANA TERENZI EXTRAIT DE PARFUM ECSTASY U EDP 100ML
3605533315408,LANCOME TESTER TRESOR LA NUIT W EDP 75ML
3348901208147,DIOR VERNIS- COURURE COLOUR GEL SHINE AND LONG WEAR NAIL LACQUER-108
3274870001291,KENZO L'EAU PAR KENZO COLORS W EDT 50ML
3760033632810,THE DIFFERENT COMPANY TOKYO BLOOM U EDT 90ML
679602871068,POLICE DNA EDT 50 ML M
3365440072008,YSL ROUGE PUR COUTURE THE MAT-625-36
3386460015745,LANVIN L.HOMME M SPORT 100ML
3348900378575,DIOR HYPNOTIC POISON EDT 50ML
3380811128108,CLARINS HYDRAQUENCH CREAM MASK 75ML-128
3346131405404,HERMES TERRE METAL REFILABILE EDP M 150 ML
3605473198291,BENETTON NERO MAN EDT 100ML
3348901076609,DIOR ADDICT EXTREME- LASTING LIPCOLOUR RADIANT SHINE- 866
3348901140836,DIOR SHOW ART PEN- FELT TIP EYELINER- 095
3348901197748,DIOR ONE ESSENTIAL INTENSE SKIN DETOXIFYING BOOSTER SERUM 50 ML
3760209750294,OLFACTIVE STUDIO FLASH BACK EDP 100ML
8033488151812,XERJOFF JOIN THE CLUB MORE THAN WORDS EDP 50ML
3439609005012,SWAROVSKI INTENSE COLLECTION MARIAGE W EDT 50 ML
3348901207409,DIOR ADDICT FLUID STICK- FABULOUS WEAR HIGH IMPACT GLOSSY COLOUR LIP HYBRID- 389
3348901157230,DIOR ROUGE COUTURE COLOUR VOLUTUOUS CARE- 844
3360372058861,GIORGIO ARMANI AQUA DI GIO M EDT 50ML
3274870553455,GIVENCHY PLAY INTENSE 50ML
3760033632803,THE DIFFERENT COMPANY AFTER MIDNIGHT U EDT 90ML
3348901177788,DIOR CRAYON CONTOUR LEVRES LIP LINER PENCIL 532
3348901103510,DIOR SKIN NUDE FOUNDATION SKIN- GLOWING MAKE UP SPF 15- 040
3365440714670,YSL GLOSS VOLUPTE 49735-201
3760209750058,OLFACTIVE STUDIO STILL LIFE EDP 100ML
3348901264570,DIOR ADDICT LIPSTICK SENSATIONAL COLOUR HYDRA GEL CORE MIRROR SHINE 976
3348901151832,DIOR HYDRA LIFE BB CREAM- ENHANCING MOISTURIZER FOR IMMEDIATE BEAUTY SPF 30- PA+++ 50 ML- 03
8033488151737,XERJOFF JOIN THE CLUB 40KNOT EDP 50ML
3274870001307,KENZO L'EAU PAR KENZO POUR HOMME COLORS EDT 50ML
3605532296333,LANCOME CONCEALER PEN TEINT MIRACLE NATURAL LIGHT CREATOR BASE SKIN PERFECTION -03
3348901248273,DIOR SKIN NUDE AIR TAN POWDER-HEALTHY GLOW SUN POWDER-WITH KABUKI BRUSH-001
3365440383043,YSL COTURE MONO YEY SHADOW 11
3348901219556,DIOR SKIN STAR FOUNDATION -STUDIO MAKEUP SPECTACULAR WEIGHTLESS PERFECTION SPF30 PA++ -041
3380811067100,CLARINS EXTRA FIRMING NIGHT 50 ML
3508441106413,CREED ORIGINAL SANTAL M   120ML
3348901112833,DIOR CAPTUR TOTAL- NURTURING RICH CREAM- NORMAL TO COMBINATION SKIN 60 ML
3348900956063,DIOR MOUSSE PURETE NETTOYANTE-PURIFYING- FOAMING CLEANSER- NORMAL TO COMBINATION SKIN 125 ML
8033488153281,XERJOFF CASAMORATI 1888 GRAN BALLO EDP 100ML
8033488151072,XERJOFF CASAMORATI 1888 REGIO EDP 100ML
3348901157476,DIOR ROUGE COUTURE COLOUR VOLUTUOUS CARE- 468
8033488151768,XERJOFF JOIN THE CLUB COMANDANTE EDP 50ML
3760209750553,OLFACTIVE STUDIO PANORAMA EDP 100ML
3346131700028,HERMES EAU DES MERVEILLES EDT 50ML
888066008877,TOM FORD VIOLET BLONDE 100ml
3274872269620,FENDI LEATHER ESSENCE W EDP 50ML
8011003100026,MOSCHINO TOUJOURS GLAMOUR W EDT 50ML
3348901199728,DIOR HYDRA LIFE CLOSE UP PORE REDUCING PRO-YOUTH MOISTURIZER 50 ML
8435137735174,PRADA LUNA ROSSA EXTREME M EDP 50ML
8028713240218,ACQUA DI PARMA AMBRA EDC CONCENTREE 100 ML
3346470113930,GUERLAIN - SHALIMAR - First 2011 EDP W 100ml
783320822414,BVLGARI ROSE ESSENTIELLE W EDP W 100 ML
3365440384125,YSL COTURE MONO YEY SHADOW 17
3380814227716,CLARINS OMBRE MATTE CREAM TO POWDER MATTE EYESHADOW-277-07
3348901125413,DIOR SHOW MONO-WET&DRY BACKSTAGE EYESHADOE-616
8411061765203,CAROLINA HERRERA 212 MEN SUMMER 2013 EDT 60ml
3274870372469,GIVENCHY ANGE OU EDP 100ML
3386460011600,S.T. DUPONT PASSENGER POUR HOMM EDT 100 ML
3380814709618,CLARINS FACE&BLUSH POWDER
3380814422814,CLARINS LIPLINER PENCIL-171-04
8426017034920,LOEWE AGUA MEDITERRANEO EDT 150ML
3274870372452,GIVENCHY ANGE OU EDP 50ML
3346131402007,HERMES TERRE 200ML
3605533491232,LANCOME RENERGIE MULTI LIFT RED EFINING LIFTING CREAM ALL SKIN 50 ML
3365440197695,YSL ROUGE VOLUPTE SHINE-212-7
8033488153267,XERJOFF CASAMORATI 1888 EDP 100ML
8033488153557,XERJOFF CASAMORATI 1888 MEFISTO EDP 100ML
701666312925,AMOUAGE MAN EPIC EDP 100ML
3147752770229,LANCOME GLOSS JUICY TUBES ULTRA SHINY HYDRATING LIP GLOSS -022
3605530317559,LANCOME GLOSS JUICY TUBES ULTRA SHINY HYDRATING LIP GLOSS -094
3365440235762,YSL FOREVER LIGHT CREATOR SERUM-403
8033488153595,XERJOFF CASAMORATI 1888 LIRA EDP 100ML
4013670507652,AIGNER POUR FEMME W EDP 60ML
3348901137454,DIOR SKIN NUDE BB CREME-NUDE GLOW SKIN- PERFECTION BEAUTY BALM SPF 10- PA+ -003
3348901219853,DIOR SKIN STAR CONCEALER- SCULPTING BRIGHTENING CONCEALER- 003
3352810308799,KENZO - L`EAU PAR KENZO POUR HOMME WILD EDITION 2011 (M)
3348900956056,DIOR LAIT PURETE DEMAQUILLANT- PURIFYING CLEANSING MILK- NORMAL TO COMBINATION SKIN 200 ML
3274871935861,GIVENCHY GENTELMAN 100 ML
3274878222568,GIVENCHY PI M 100 ML
4013670507645,AIGNER POUR FEMME W EDP 100ML
3348900956070,DIOR LOTION PURETE TONIFIANTE-PURIFYING TONING LOTION- NORMAL TO COMBINATION SKIN 200 ML
3349668528660,PACO RABANNE OLYMPEA W EDP 50ML
8033488153588,XERJOFF CASAMORATI 1888 BOUQUET IDEALE EDP 100ML
3352810308805,KENZO - L`EAU PAR KENZO WILD EDITION 2011 (W)
3352818208152,KENZO-JUNGLE POUR HOMME-2011 EDT 100ML
3349668536139,PACO RABANNE OLYMPEA W EDP 80ML
3380813061106,CLARINS SUPER MOISTURE GEL MEN 50 ML
3605532999005,LANCOME ABSOLUE SUBLIME REGENERATING OLEO-SERUM 30ML
701666311171,AMOUAGE REFLECTION W 100ML
3423474873555,ISSEY MIYAKE L'EAU DISSEY POUR HOMME M EDT 125 ML
3386460011617,S.T.DUPONT PASSENGER FOR MEN M EDT 50ML
3760048791168,LORIENCE LULU ROSE EDP 100 ML
3348901180320,DIOR ROUGE COUTURE COLOUR VOLUTUOUS CARE- 543
8033488150938,XERJOFF SHOOTING STARS UDEN SILK BAG EDP 100ML
8033488150976,XERJOFF SHOOTING STARS LUA SILK BAG EDP 100ML
6084000005030,SHAIK OPULENT SHAIK GOLD EDITION M 100ML
3380810042559,CLARINS INSTANT BLADE LINER LONG LASTING INTENES COLOUR
3386460036474,BOUCHERON JAIPUR BRACELET W EDP 50 ML
701666315124,AMOUAGE INTERLUDE W 100ML
701666314929,AMOUAGE MAN HONOUR EDP 100ML
8411061757994,VALENTINO SET UOMO EDT 100ML + AFTERSHAVE 100ML
4800989258142,VICTORIA SECRET STICK REXONA ابي
4045787123050,SCHWARZKOPF موس احيا کننده و رطوبت رسان
3661163941066,VICTORIA SECRET افتر شيو ADIDAS  fire
637293297376,VICTORIA SECRET شاور زل PURE SEDUCTION
637293062295,VICTORIA SECRET BODY ZINK
667530181854,VICTORIA SECRET BORONZE: SHEER LOVE
4800980551044,VICTORIA SECRET STICK REXONA
8432225042664,REVLON رنگ موي 5.64
4045787141511,SCHWARZKOPF جلستيک
3600521972519,L'OREAL شامپو صاف كننده موهاي فر ليس
8432225014197,REVLON شامپو تقویتی 350ML
667531334235,VICTORIA SECRET BODY LOTION NEW V/S LAVENDER &VANILLA
667530678316,VICTORIA SECRET BODY LOTION V/S MOISTURE LUXE
4444,CANDLE شمع JAR CANDLE
8432225024479,REVLON اسپری ایرسان 500ML
8432225030814,REVLON شامپو بعد از رنگ رولن (1000 ميلي ليتر )
8855629213285,MISTINE مام ضد عرق قوي
5060315030098,BODY CREAM LUXER DARK KISS
5060315030258,BODY CREAM LUXER LIFE AMOUR
8432225997834,REVLON رنگ موي SN6 فوق طبيعي رولونيسيمو
8855629362730,MISTINE شامپو بچه ضد سوزش
8432225132495,REVLON رنگ موي شماره 10/23 رولنيسيمو
3600520977799,L'OREAL رنگ مو  کستینگ 600
3600522016229,L'OREAL نرم كننده تقويت كننده مو ارژين رزيست 200ميل السو لورال
3054080045465,L'OREAL شامپو حاوي ويتامين ويتا مكس 250 ميل
667530632172,VICTORIA SECRET BODY LOTION NEW V/S WHITE TEA & SAGE
3412242630155,VICTORIA SECRET افتر شيو   ice ADIDAS
8015150291750,COLLISTAR HIGHLIGHTING LONG LASTING COLOR SHAMPOO 175
4800980550887,VICTORIA SECRET STICK REXONA سرخابي
8015150291514,COLLISTAR EXTRA DELICATE MULTIVITAMIN CONDITIONER-151
8432225014425,REVLON اسپري نگهدارنده حجم دهنده مو 500 ميل
6914600218168,BODY LUXER BODY SPLASH WILD KISS تک فاز
309973155008,REXONA STICK UNSCENTED
8432225042626,REVLON رنگ موي 5/20
3600541124165,GARNIER رنگ مو E0
3600541123960,GARNIER رنگ مو 110
5060315030710,BODY LUXER SHIMER MINI 88ML CARRIED AVAY
3054080053293,L'OREAL شامپو موهاي چرب ومعمولي سيترو 250 میل
4046871000059,MISTINE پد ارايش پاکن 75 تايي الوورا ويتامين بي5
3600521756706,L'OREAL شامپو موهاي شكننده و اسيب ديده
5060315033662,VICTORIA SECRET BODY SHIMER 88M   SECRET
4005808189595,ژل شستشوی پوست چرب 150 میل
8432225030623,REVLON اسپری براق کننده 50 میل اروفلوئیدو shine
8015150290265,COLLISTAR S NOURISHING ANTI-FRIZZ PACK MASK -026
8015150290258,COLLISTAR S STRAIGHTENING ANTI FRIZZ SHAMPOO-025
4015000935593,SCHWARZKOPF موس تافت نقره اي کلاسيک قوي3(خط بنفش) TAFT
5060315030708,BODY LUXER SHIMER MINI 88ML LIFE AMOUR
5060315035970,BODY LUXER SHIMER MINI 88ML COUNTRY CHIC
5060315034928,BODY LUXER SHIMER MINI 88ML BLOSSOM
5060315036175,VICTORIA SECRET BODY SHIMER 88M INTO THE WILD
4045787121698,SCHWARZKOPF شامپو تثبيت كننده رنگ مو
4045787141245,SCHWARZKOPF آپ لود  OSIS 200MG
8003510015871,INTESA VITACEL ست
5030,کیف ارایشی ویکتوریا سکرت بری بربی VICTORIA SECRET
8432225997810,REVLON رنگ موي N7 طبيعي رولونيسيمو
8432225997803,REVLON رنگ موي N6 طبيعي رولونيسيمو
8432225014289,REVLON شامپو مخصوص موی چرب 350ML
79656400137,TANNING OIL روغن برنزه
8432225042718,REVLON رنگ مو6/24رولنیسیمو60 میل
8855629320129,MISTINE تونر ضد جوش
5060315035366,VICTORIA SECRET BODY SHIMER   JAPANESE
5060315030111,BODY CREAM LUXER MIDNIGHT
6914600213361,BODY LUXER BODY SPLASH VERY COCOBERRY 2فاز
8015150290005,COLLISTAR S SUPERNOURISHING SHAMPOO-000
3600521188057,L'OREAL رنگ مو  کستینگ 630
8432225043036,REVLON رنگ موي 9/01
4045787141221,SCHWARZKOPF شاين داست 15 گرم
5060315030709,BODY LUXER SHIMER MINI 88ML WARM VANILLA SUGAR
5060315033839,BODY LUXER SHIMER MINI 88ML CHERRY BLOSSOM
8432225024387,REVLON اسپری 2فاز ابرسان 200ML
7021,NUTRIGA پاف نوتریگا
3600520058559,L'OREAL لوسیون پاک کننده پیورزن
6914600218182,BODY LUXER BODY SPLASH CANDY BABY تک فاز
5060315035285,VICTORIA SECRET BODY LOTION LUXURIES
8432225000114,REVLON سرم فوق قوي تقويت كننده موي رنگ شده (20*10 ميلي ليتر)
4045787140231,SCHWARZKOPF کرم تقويتي صاف و براق کننده
5060315035420,BODY LUXER SHIMER MINI 88ML SWEET PEA
3600521757406,L'OREAL اسپري حجم دهنده سيلک
5020,کیف ارایشی ویکتوریا سکرت زیپ رنگی VICTORIA SECRET
8432225014340,REVLON شامپو ضد ریزش 350 میل pro you
4045787129885,SCHWARZKOPF شامپو تقويتي و ترميم کننده موهاي فرسوده Q10
3052503505671,BOURJOIS شامپو بدن قهوه
6914600216829,BODY LUXER SHINER ATTRACTIUE
3600521767573,L'OREAL شامپو توتال ريمير 5-250 ميلي
3600520070131,L'OREAL کرم AGE PERFECT دور چشم 15 میل
6914600216843,BODY LUXER SHINER TROPICAL
9007867004128,DECLARE لوسيون بعد افتاب
4801957346243,REXONA STICK HYPNOSIS FRESH
3600521855423,L'OREAL شيرپاك كن روز تريپل اكتيو پوست حساس 200 ميل
7022,NUTRIGA مژه مصنوعی 114
8432225999852,REVLON سرم محافظ موهاي رنگ شده
8432225042831,REVLON رنگ موی 7/24رولنیسمو 60میل
4801957346069,REXONA STICK SHOWER CLEAN
4045787144598,SCHWARZKOPF كانديشنر تقويتي ، ترميم و احيا كننده
4045787144703,SCHWARZKOPF كرم مو براي موهاي فر
6914600218663,BODY LUXER SHINER WILD
3055306030050,ECOO DUNHILL SPRAY
6914600212739,BODY LUXER BODY SPLASH COCONUTTY 2فاز
8003510015870,INTESA ENERGY ست
667530632073,VICTORIA SECRET BODY SPLASH NEW V/S ORCHID & BAMBOO
4005808188826,پاک کننده کرمی پوست خشک و حساس 150 میل
667533549897,VICTORIA SECRET BODY SPLASH VICTORIA SECRET NEW DARE
767503589636,CALIFORNIA TAN INFINITI
8717163328149,VICTORIA SECRET REXONA SPRAY W AQUA
6914600218649,BODY LUXER SHINER 250ML
8855629213377,MISTINE اسپري ضد عرق UNIQ
8855629203194,MISTINE پودر بدن خوشبو کننده و ويتامينه
700700705,BAG کیف کنفی فانتزی کوچک
3054080074335,L'OREAL شیر پاک کن ایچ پرفکت
8711600493469,VICTORIA SECRET REXONA SPRAY W COTTON
3600521728697,L'OREAL کرم مرطوب کننده روز تریپل اکتیو 50 میل پوست خشک
8018556501706,SCHWARZKOPF ZERO سرم مو
700700710,BAG کیف آستری مدل گلدوزی
8432225031453,REVLON کانديشنر 200 ميل
6914600216898,BODY LUXER SHINER CHARM SWEETHEART
42219125,NIVEA رول 8*4 ديسكاوري
8410412028752,BABARIA ژل برنزه اکلیلی نارگیل
8855629364017,MISTINE زل شستشوي بانوان
414000003471,VICTORIA SECRET SHIMMER OH LA LA
7005,NUTRIGA فر مژه فلزدار
700700703,BAG کیف چرمی حصیری
700700701,BAG کیف طلقی مارک فلزی کوچک
3605470202991,VICTORIA SECRET SHOWER GEL BENETTON CUMBIA MAN
3600520682235,L'OREAL کرم کلاژن پر کننده چروک
667532494488,VICTORIA SECRET ENCHANTED NIGHTS
3055306030081,ECOO ARAMIS SPRAY
8699990522658,ECCO YATAGAN CARON SPRAY
8855629361252,MISTINE محلول شستشوي بانوان
8411322232734,VIGORANCE اسپری نگهدارنده و حالت دهنده مو قوی 750 میل
37000123439,VICTORIA SECRET STICK NEW SECRET POWDER FRESH
3052503505633,BOURJOIS شامپو بدن صورتي اكلت
4005808868933,نیوا ماسک مو استریت ترمیم کننده و لخت کننده 150 میل
667523880924,VICTORIA SECRET BODY SPLASH BATH & BODY WORKS SAPPHINE
667533554877,VICTORIA SECRET BODY SPLASH V/S LOVE NEW
4046871000141,MISTINE گوش پاکن 300 تايي
3052503507378,BOURJOIS مينرال ابي
8410412028684,BABARIA باباریا روغن شکلات SPF0
8432225038018,REVLON ماسک 500 میل اروفلوئیدو
3055306030197,ECOO FAHRENHEIT SPRAY
637293128076,VICTORIA SECRET BODY SPLASH BATH & BODY WORKS ENCHANTED ORCHID
8432225000053,REVLON کرم ماسک فوق قوی محافظ رنگ 200 میل
8432225132358,REVLON رنگ موي SN8 فوق طبيعي رولونيسيمو
65306833,VICTORIA SECRET SHOWER GEL BATH&BODY WORKS COTTON BLOSSOM
5000444016587,روغن برنزه CYCLOIX
5060315036359,VICTORIA SECRET BODY SHIMER 88M   WHIT CITRUS
8432225014302,REVLON شامپو ضد شوره 350 ميل
6914600216904,BODY LUXER SHINER WOODS
6914600216867,BODY LUXER SHINER MYTH KISS
8711600363953,DOVE SHOWER GEL GO FRESH
3600521704226,L'OREAL شامپو ترميم كننده مو توتال ريپير (5)0
667530678309,VICTORIA SECRET BODY SPLASH NEW V/S RICH INDULGENCE
700700707,BAG کیف پارچه ای خمره ای
48308984,VICTORIA SECRET MANGO MANDARIN
5040,کیف ارایشی ویکتوریا سکرت ساده VICTORIA SECRET
8432225042244,REVLON رنگ موي 6SN
8410412028257,BABARIA دئورولان زیتون150میل
7068,NUTRIGA ناخن گیر دوقلو
8717163340455,REXONA SPRAY W ALOE VERA
4045787149777,SCHWARZKOPF كرم كاسه اي تقويتي و ترميم كننده موهاي خشک و صدمه ديده BONACURE
3600520751276,L'OREAL نرم كننده و درخشان كننده مو نوتري گلاس
4045787145922,SCHWARZKOPF شامپو تقویت کننده و ضد ریزش بناکور BONACURE
8855629361641,MISTINE کرم دست و صورت مرطوب کننده ضد پيري
667532722925,VICTORIA SECRET BODY LOTION MIDNIGHT EXOTICS VANILLA
